,Timestamp,Metadata,Headline,URL,ShortDesc
253,2018-04-24T08:00:00+00:00,politics," Cambridge Analytica Tale ‘Disturbing,’ Democratic Lawmaker Says ",https://www.bloomberg.com/politics/articles/2018-04-24/cambridge-analytica-whistle-blower-to-meet-with-house-democrats," more active Facebook users in the EU than in the USA, which makes Mark Zuckerberg’s reluctance to address international lawmakers all the more disappointing,"" Wylie said of the Facebook chief executive... "
254,2018-04-23T22:58:00+00:00,markets, Stock Picks From Top Money Managers at the Sohn Conference ,https://www.bloomberg.com/news/articles/2018-04-23/sohn-conference-roundup-stock-picks-of-some-top-money-managers, going long the SPDR S&P Oil & Gas Exploration & Production ETF and shorting Facebook. Bearish bets against Facebook have increased since a data-privacy scandal engulfed the social-media giant in... 
255,2018-04-23T21:04:49+00:00,markets, Five Things You Need to Know to Start Your Day ,https://www.bloomberg.com/news/articles/2018-04-23/five-things-you-need-to-know-to-start-your-day-jgcqcoku," Bitcoin Cash, which was spun off last year. Through a war of words playing out on Twitter and Facebook, some of the largest holders of both cryptocurrencies are attempting to influence the coins’... "
256,2018-04-23T18:58:06+00:00,technology, Here’s Why Everyone Is Getting Into the Home-Flipping Business ,https://www.bloomberg.com/news/articles/2018-04-23/here-s-why-everyone-is-getting-into-the-home-flipping-business," its AI assistant, TmallGenie, into around 100 automobile brands.Old hatreds find new life on Facebook. In Sri Lanka, the social network has become a forum for spreading race-based rumors and communal... "
257,2018-04-23T18:41:02+00:00,markets, Bitcoin Rival Accused of Trying to Artificially Boost Its Price ,https://www.bloomberg.com/news/articles/2018-04-23/bitcoin-cash-burning-claim-adds-fire-to-pr-battle-with-bitcoin," Bitcoin Cash, which was spun off last year. Through a war of words playing out on Twitter and Facebook, some of the largest holders of both cryptocurrencies are attempting to influence the coins’... "
258,2018-04-23T17:43:08+00:00,, Bloomberg View Radio: Weekend Edition for the Week of 4-20-18 ,https://www.bloomberg.com/news/audio/2018-04-23/bloomberg-view-radio-weekend-edition-for-the-week-of-4-20-18," Cathy O’Neil, mathematician and Bloomberg View columnist: ""Legislators Are Missing the Point on Facebook."" James Gibney, Bloomberg View editor: ""Keeping Trump’s Trust Is Key to Reviving Diplomacy.""... "
259,2018-04-20T10:39:58+00:00,politics, Opposition Seeks Impeachment of India’s Top Judge ,https://www.bloomberg.com/politics/articles/2018-04-20/india-s-judiciary-in-crisis-as-chief-justice-faces-impeachment," that if you don’t agree with us, fifty MPs are enough for a revenge action,"" Jaitley wrote on Facebook on Friday. Judicial CrisisThe motion to remove the chief justice will not succeed because it... "
260,2018-04-20T06:00:32+00:00,gadfly, Brexit-Loving Pub Landlord Is Chucking Out the Internet ,https://www.bloomberg.com/gadfly/articles/2018-04-20/who-needs-twitter-when-you-ve-got-brexit-beer-mats," Martin, says the move is about setting an example to people addicted to Twitter, Instagram and Facebook who ""struggle"" to kick the habit.Silicon Valley shouldn't fret, though. While there's merit... "
261,2018-04-19T15:23:34+00:00,, Brexit May Freeze U.K. Out of Robotics and EU's Digital New Wave ,https://www.bloomberg.com/news/articles/2018-04-19/brexit-may-freeze-u-k-out-of-robotics-and-eu-s-digital-new-wave," compete.Consumers and companies need to wrest ownership of data from multinationals such as Facebook Inc. and Alphabet Inc., she said. Austria also supports the proposed 3 percent revenue tax on... "
262,2018-04-19T14:32:58+00:00,gadfly," Amazon Is Defined by Billions; Median Salary Is $28,446 ",https://www.bloomberg.com/gadfly/articles/2018-04-19/amazon-is-defined-by-billions-median-salary-is-28-446," chips and yoga rooms of Silicon Valley's rich tech campuses. Compare Amazon's median pay with Facebook Inc.'s $240,430. Just a reminder that this means half of Amazon's workers make more than $28... "
263,2018-04-19T06:30:21+00:00,, Brexit Bulletin: Another Red Line Fades ,https://www.bloomberg.com/news/articles/2018-04-19/brexit-bulletin-another-red-line-fades," contract to Franco-Dutch rival Gemalto. De La Rue’s shares fell. Something to add? Please join our Facebook group, Brexit Decoded, and follow us @Brexit on Twitter.Missed yesterday’s Bulletin?You can... "
264,2018-04-18T16:50:01+00:00,technology," Time Warner Ill-Equipped to Challenge Netflix, CEO Tells Judge ",https://www.bloomberg.com/news/articles/2018-04-18/time-warner-ill-equipped-to-challenge-netflix-ceo-tells-judge," com Inc. to stream movies and TV shows directly to consumers, and ad spending on Google and Facebook that is taking off “like a rocket.”Both trends have drawn customers and revenue from New York-based... "
265,2018-03-29T23:03:35+00:00,technology, Facebook Executive's 2016 Memo Shows Company Aware of Its Faults ,https://www.bloomberg.com/news/articles/2018-03-29/facebook-executive-s-2016-memo-shows-company-aware-of-its-faults," A 2016 memo from a Facebook Inc. executive made the case for the company’s grow-at-all-costs culture, explaining that the negative consequences of the social network -- even deaths and terrorist... "
266,2018-03-29T18:12:50+00:00,, Yankees Print Money as Home Run Derby Baseball Returns (Audio) ,https://www.bloomberg.com/news/audio/2018-03-29/yankees-print-money-as-home-run-derby-baseball-returns-audio," baseball overall, including the league’s new deal to exclusively stream 25 afternoon games on Facebook. Levine also discusses the Yankees proposed London series against the Boston Red Sox, and how... "
267,2018-03-29T19:03:07+00:00,markets, Wall Street Is Unfazed by Trump’s Disdain of Bezos and Amazon ,https://www.bloomberg.com/news/articles/2018-03-29/wall-street-unfazed-by-trump-s-disdain-of-bezos-amazon," attacking Amazon will be popular.""Bank of America Merrill Lynch, Justin Post(buy, PT $1650)""Facebook’s regulatory issues have put regulatory risk in the spotlight, and the 4.4% decline in Amazon’s... "
268,2018-03-29T10:21:18+00:00,politics, Egypt’s El-Sisi Bags Election Win Against ‘Mousa Something’ ,https://www.bloomberg.com/politics/articles/2018-03-29/egypt-nixes-mousa-something-but-sends-el-sisi-wakeup-call," Khaled Desouki/AFP via Getty ImagesMousa Mostafa Mousa -- a little-known politician dubbed by a Facebook wag as “Mousa Something Mousa” -- wasn’t expected to win this week’s presidential race, and... "
269,2018-03-28T20:54:41+00:00,markets, Investor Fear Over Tech Stocks Spreads Beyond Facebook ,https://www.bloomberg.com/news/videos/2018-03-28/investor-fear-over-tech-stocks-spreads-beyond-facebook-video," Source: Bloomberg, 04:20                                                                                                                        Bloomberg's Luke Kawa discusses the fear factor concerning... "
270,2018-06-21T13:43:08+00:00,technology, AT&T Stays in Dealmaking Mode Following Time Warner Megamerger ,https://www.bloomberg.com/news/articles/2018-06-21/at-t-sells-data-center-operations-to-brookfield-for-1-1-billion, come in. The company operates an online ad exchange and could help AT&T challenge Google and Facebook Inc. for a bigger piece of the market. AT&T is in talks to acquire the business for about $1... 
271,2018-06-21T14:04:58+00:00,view, Europe’s Migrant Problem Has an EU Answer ,https://www.bloomberg.com/view/articles/2018-06-21/migrants-test-germany-s-government-and-eu-solidarity," After initial indications that Prime Minister Giuseppe Conte might not attend, he posted on Facebook that he had been convinced to go by Merkel’s assurances that “the draft text published yesterday... "
272,2018-09-21T11:00:07+00:00,markets," Tech ETFs `Losing Curry, Durant' as GICS Changes Reorder Indexes ",https://www.bloomberg.com/news/articles/2018-09-21/tech-etfs-losing-curry-durant-as-gics-changes-reorder-indexes, media stocks into a new group called “communication services.” The shakeup will rip giants like Facebook Inc. and Google parent Alphabet Inc. out of many exchange-traded funds that track technology... 
273,2018-09-21T11:13:11+00:00,markets, Something Alarming Happened This Week. It Matters.: Taking Stock ,https://www.bloomberg.com/news/articles/2018-09-21/something-alarming-happened-this-week-it-matters-taking-stock," The latter will bring about the new Communication Services sector, a new place for FAANGs like Facebook, Alphabet, and Netflix to call home and something we’ll hear about ad nauseam once it goes into... "
274,2018-09-20T21:39:36+00:00,technology, A Top App in the Mac App Store Sent Your Data to China ,https://www.bloomberg.com/news/videos/2018-09-20/a-top-app-in-the-mac-app-store-sent-your-data-to-china-video," servers in China. He'll take questions from the audience. Watch every Thursday on Bloomberg.com, Facebook and Twitter. ... "
275,2018-09-20T17:24:48+00:00,technology, WorldRemit CEO Said to Move to Chairman Role as Fintech Eyes IPO ,https://www.bloomberg.com/news/articles/2018-09-20/worldremit-ceo-said-to-move-to-chairman-role-as-fintech-eyes-ipo," that attracted venture capitalists such as Accel Partners, the Silicon Valley firm that backed Facebook Inc. WorldRemit, which sends money to 145 countries, has raised $220 million in funding. In... "
276,2018-09-18T06:31:55+00:00,, Panel Says U.K. Prime Minister Theresa May Survives to Brexit ,https://www.bloomberg.com/news/articles/2018-09-18/panel-says-u-k-prime-minister-theresa-may-survives-to-brexit," briefly about Brexit.Want to keep up with Brexit?You can follow us @Brexit on Twitter and join our Facebook group, Brexit Decoded. For all the latest news, visit bloomberg.com/brexitKnow someone who’d... "
277,2018-09-17T19:40:57+00:00,, Bloomberg Opinion Radio: Weekend Edition for 9-14-18 (Podcast) ,https://www.bloomberg.com/news/audio/2018-09-17/bloomberg-opinion-radio-weekend-edition-for-9-14-18-podcast," columnist: ""Elon Musk’s Joke Isn’t Funny Anymore."" Leonid Bershidsky, Bloomberg Opinion columnist: ""Facebook and Its Users Don’t Tell Same Story."" Tim O’Brien, Executive Editor for Bloomberg Opinion: ""Melania’s... "
278,2018-09-14T01:40:47+00:00,politics, Warren Says Financial Giants Should Be Brought Down to Size ,https://www.bloomberg.com/politics/articles/2018-09-14/warren-says-financial-giants-should-be-brought-down-to-size, WarrenPhotographer: Andrew Harrer/BloombergShe also said that the size of technology giants like Amazon and Facebook worries her and that companies shouldn’t be able to collect data from consumers and then turn... 
279,2018-10-28T23:12:27+00:00,technology," Ahead of Facebook Earnings, Analysts Hope It Can't Get Any Worse ",https://www.bloomberg.com/news/articles/2018-10-28/ahead-of-facebook-earnings-analysts-hope-it-can-t-get-any-worse," Facebook Inc. is nearing the end of its toughest year as a public company. Ahead of results on Tuesday, analysts are hoping the news can’t get any worse.The social-media giant is expected to report... "
280,2018-03-27T20:46:15+00:00,markets, Treasuries Finally Give In to Tech Turmoil ,https://www.bloomberg.com/news/articles/2018-03-27/treasuries-finally-give-in-to-tech-turmoil-as-10-year-below-2-8, Bond bulls just sent a friend request to Facebook Inc.The turmoil around the social media company -- and technology stocks in general -- has driven 10-year Treasury yields to the brink of breaking... 
281,2018-03-27T16:57:44+00:00,, Zuckerberg to Testify Before Congress ,https://www.bloomberg.com/news/videos/2018-03-27/zuckerberg-to-testify-before-congress-video, Facebook's Mark Zuckerberg has decided to testify before Congress after repeated calls to answer questions... 
282,2018-03-27T14:58:03+00:00,politics, #DeleteNetflix Campaign Erupts in Brazil ,https://www.bloomberg.com/politics/articles/2018-03-27/-deletenetflix-campaign-erupts-in-brazil-over-corruption-show," While the world rebels against Facebook Inc., Netflix Inc. is stirring up controversy in Brazil.A small but loud #DeleteNetflix campaign has burst forth on Twitter since ""The Mechanism,"" a show... "
283,2018-03-27T12:23:39+00:00,markets, Allianz Global's Dwane Says Mark Zuckerberg Has Failed ,https://www.bloomberg.com/news/videos/2018-03-27/allianz-global-investors-dwane-says-mark-zuckerberg-has-failed-video," (Video)Source: Bloomberg, 01:32Neil Dwane, global strategist at Allianz Global Investors, discusses Facebook’s performance amid pressure. He speaks with David Westin and Julia Chatterley on ""Bloomberg Daybreak:... "
284,2018-03-26T20:37:28+00:00,, Your Evening Briefing ,https://www.bloomberg.com/news/articles/2018-03-26/your-evening-briefing, every afternoon? Sign up here. The last time the Dow had a day this good: 2015. The last time Facebook had a month this awful: 2012. The last time “60 Minutes” got ratings this high: 2008. The last... 
285,2018-03-26T11:00:11+00:00,technology, Regulators Are Asleep at the Wheel on Self-Driving Cars ,https://www.bloomberg.com/news/articles/2018-03-26/regulators-are-asleep-at-the-wheel-on-self-driving-cars, granted a warrant to search the offices of the company at the center of the controversy over how Facebook members’ personal data was exploited in Brexit and U.S. presidential elections. ... 
286,2018-03-26T14:48:03+00:00,, FTC Confirms Facebook Probe Over Privacy Practices ,https://www.bloomberg.com/news/articles/2018-03-26/ftc-says-it-has-an-open-non-public-probe-on-facebook-practices-jf8ckbp0," The U.S. Federal Trade Commission confirmed it has an open, non-public investigation into Facebook Inc.’s privacy practices.“The FTC is firmly and fully committed to using all of its tools to protect... "
287,2018-03-26T09:33:29+00:00,," Commerzbank Predicts Higher Profit, Confirms Plan for Dividend ",https://www.bloomberg.com/news/articles/2018-03-26/commerzbank-predicts-higher-profit-confirms-plan-for-dividend, Engels said on the bank’s analyst call in February. Commerzbank decided to suspend advertising on Facebook in the wake of the social media company’s data controversy. ... 
288,2018-03-26T08:07:39+00:00,politics, Corbyn on Defensive as U.K. Jewish Groups Protest Anti-Semitism ,https://www.bloomberg.com/politics/articles/2018-03-26/corbyn-on-defensive-as-u-k-jews-protest-against-antisemitism," to our Jewish community in the Labour Party and the rest of the country,” Corbyn wrote on his Facebook page. “I will not tolerate any form of antisemitism that exists in and around our movement. ... "
289,2018-03-23T21:51:28+00:00,technology," Dropbox Tops Private Value, Shares Soar in Market Debut ",https://www.bloomberg.com/news/articles/2018-03-23/dropbox-tops-private-value-as-shares-soar-in-market-debut, company made its public market debut at a time when technology stocks have slipped out of favor. Facebook Inc. has dropped about 14 percent this past week as it acknowledged its mishandling of user... 
290,2018-01-12T15:50:53+00:00,technology, Here's What Wall Street Says About Facebook Prioritizing People ,https://www.bloomberg.com/news/articles/2018-01-12/here-s-what-wall-street-says-about-facebook-prioritizing-people," commentary by early Facebook employees (Sean Parker and Chamath Palihapitiya), early Facebook investors (Roger McNamee) and others, as well as a congressional investigation of Facebook’s impact on the... "
291,2018-01-12T12:13:21+00:00,, Facebook is changing its News Feed ,https://www.bloomberg.com/news/videos/2018-01-12/facebook-is-changing-its-news-feed-video, Facebook hopes to improve its user experience by prioritizing posts from friends and family over posts... 
292,2018-01-12T11:41:43+00:00,markets, Five Things You Need to Know to Start Your Day ,https://www.bloomberg.com/news/articles/2018-01-12/five-things-you-need-to-know-to-start-your-day," ""pyramid schemes.""What we've been readingThis is what's caught our eye over the last 24 hours.Facebook unveils  sweeping changes. Trump calls African nations, Haiti  ‘shithole’ countries…As he scraps... "
293,2018-01-12T04:11:27+00:00,," Shareholders Press Twitter, Facebook to Curb Sexual Harassment ",https://www.bloomberg.com/news/videos/2018-01-12/shareholders-press-twitter-facebook-to-curb-sexual-harassment-video,"                                                                        Social media giants, Facebook and Twitter, are facing heat from shareholders, this time to combat sexual harassment of women... "
294,2018-01-10T02:00:11+00:00,, The $100 Million Game Turkish Officials Worry Is Pyramid Scheme ,https://www.bloomberg.com/news/articles/2018-01-10/the-100-million-game-turkish-officials-worry-is-pyramid-scheme," Fame Game -- is based in Northern Cyprus to avoid tax.Criminal Investigation Advertisements on Facebook, Twitter and YouTube carried a theme song that pledges you'll “double your investment in one... "
295,2018-01-09T17:05:23+00:00,, Facebook’s Business Model Relies On Polarizing Fears: McNamee ,https://www.bloomberg.com/news/audio/2018-01-09/facebook-s-business-model-relies-on-polarizing-fears-mcnamee-jc7w05g2," co-Founder of Elevation Partners, on the appropriate role of internet monopolies in society, and why Facebook still has time to rectify itself. Joel Levington, Senior Credit Analyst for Bloomberg Intelligence... "
296,2018-01-08T07:30:48+00:00,politics, Brexit Bulletin: What the Reshuffle Means for Brexit ,https://www.bloomberg.com/news/articles/2018-01-08/brexit-bulletin-what-the-reshuffle-means-for-brexit," Trump’s team has described the book as “fantasy.”For more on Brexit follow Bloomberg on Twitter, Facebook and Instagram... "
297,2018-01-08T09:00:17+00:00,, America’s Home Nurse Shortage is Stranding Kids in Hospitals ,https://www.bloomberg.com/news/features/2018-01-08/america-s-home-nurse-shortage-is-stranding-kids-in-hospitals," according to Chief Nursing Officer Diane Hupp. Williams has resorted to posting pleas for nurses on Facebook. Other than that, there’s little that she or the hospital can do.“I want to be able to wake... "
298,2018-01-05T11:17:02+00:00,technology, Amazon Plans Bid for Premier League Streaming Rights ,https://www.bloomberg.com/news/articles/2018-01-05/amazon-is-said-to-plan-bid-for-premier-league-streaming-rights," auction there has been speculation that one or more of the digital giants, such as Amazon or Facebook Inc. might take on the traditional broadcasters for the first time, potentially causing an uplift... "
299,2018-01-05T07:29:49+00:00,, Brexit Bulletin: How the Deal Could Unravel ,https://www.bloomberg.com/news/articles/2018-01-05/brexit-bulletin-how-the-deal-could-unravel," assistance from Ian Wishart and Alex MoralesFor more on Brexit follow Bloomberg on Twitter, Facebook and Instagram... "
300,2018-01-04T21:45:08+00:00,, Your Evening Briefing ,https://www.bloomberg.com/news/articles/2018-01-04/your-evening-briefing, Zuckerberg wants to fix Facebook. The CEO pledged to stop the spread of hate speech and fake news that's bedeviled his social network. He vowed to take a comprehensive look at Facebook’s role in society... 
301,2018-01-04T22:28:20+00:00,technology, Mark Zuckerberg Says Facebook to Look Into Cryptocurrency ,https://www.bloomberg.com/news/articles/2018-01-04/mark-zuckerberg-says-facebook-to-look-into-cryptocurrency, Facebook Inc. Chief Executive Officer Mark Zuckerberg gave cryptocurrency enthusiasts a little optimism for the new year.Zuckerberg referenced cryptocurrencies in a posting Thursday in which he... 
302,2018-01-04T17:08:13+00:00,technology, Zuckerberg Says Fixing Facebook Is His Personal Goal for 2018 ,https://www.bloomberg.com/news/articles/2018-01-04/zuckerberg-says-fixing-facebook-is-his-personal-goal-for-2018," outlines a personal goal for the coming 12 months, said this year’s objective is fixing Facebook.Facebook, the social network Zuckerberg founded in 2004 and runs as chief executive officer, “has... "
303,2018-01-04T16:26:05+00:00,, Angela Merkel Takes On Facebook: Bloomberg QuickTake (Audio) ,https://www.bloomberg.com/news/audio/2018-01-04/angela-merkel-takes-on-facebook-bloomberg-quicktake-audio, This Bloomberg QuickTake looks at how the Radio +1-212-617-5560 Running time 01:12... 
304,2018-01-03T12:00:09+00:00,technology, My New New Year’s Resolution ,https://www.bloomberg.com/news/articles/2018-01-03/my-new-new-year-s-resolution,"  ""2018 is going to be an interesting year for Facebook. I’m hearing a lot of people’s New Year's resolution is less (and often giving up Facebook),"" tweeted Creative Strategies' Ben Bajarin.I haven't... "
305,2018-06-25T10:00:32+00:00,view, Google and Facebook Turn On the Fake Riviera Charm ,https://www.bloomberg.com/view/articles/2018-06-25/google-and-facebook-turn-on-the-fake-riviera-charm," Silicon Valley giants were eager to peddle the same conciliatory narrative. It’s important for Facebook Inc. and Alphabet Inc.’s Google to not be seen as too dominant, for fear of riling the regulators... "
306,2018-06-24T22:00:00+00:00,technology, Google Tackles Facebook in India With Hyper-Local Social Network ,https://www.bloomberg.com/news/articles/2018-06-24/google-tackles-facebook-in-india-with-hyper-local-social-network," analyst, Satish Meena.Google has long aspired to be the go-to platform in India, where rivals Facebook Inc. and its WhatsApp messaging service have already amassed a huge user base and Amazon Inc... "
307,2018-06-25T23:18:55+00:00,technology," Naspers CEO Talks Tencent Stake, Taking on Netflix and Facebook ",https://www.bloomberg.com/news/videos/2018-06-25/naspers-ceo-on-tencent-stake-taking-on-netflix-and-facebook-video," Source: Bloomberg, 10:42Africa’s biggest company by market cap reported a 72 percent increase in full-year earnings. Naspers credits classified advertising and its e-commerce business for the boost... "
308,2018-06-23T12:00:20+00:00,politics," The Border, AR-15s, Drones and Dogs: Balance of Power’s Weekend Reads ",https://www.bloomberg.com/politics/articles/2018-06-23/the-border-ar-15s-drones-and-dogs-balance-of-power-s-weekend-reads," morning? Sign up for the Balance of Power newsletter, and follow Bloomberg Politics on Twitter and Facebook for more.President Donald Trump reversed his policy of separating kids from their parents for... "
309,2018-06-27T21:52:36+00:00,, Facebook seeking broadcast rights for Premier League ,https://www.bloomberg.com/news/videos/2018-06-27/facebook-seeking-broadcast-rights-for-premier-league-video," Facebook has emerged as a contender for broadcast rights for the English Premier League, sources say... "
310,2018-11-26T18:12:28+00:00,politics, Apple Gets Skepticism at Top Court in Bid to Stop Antitrust Suit ,https://www.bloomberg.com/news/articles/2018-11-26/justices-seem-inclined-to-allow-iphone-app-suit-against-apple," expensive antitrust claims. A broad ruling could affect Alphabet Inc.’s Google, Amazon.com Inc., Facebook Inc., Etsy Inc. and DoorDash Inc., Apple and its supporters say.The case is Apple v. Pepper... "
311,2018-11-29T14:01:53+00:00,technology, Facebook Exempts News Publishers From Archive on Political Ads ,https://www.bloomberg.com/news/articles/2018-11-29/facebook-exempts-news-publishers-from-archive-on-political-ads, Facebook Inc. said it will stop including some publishers’ advertising in its political ad archive following months of criticism from news organizations.Next year the social media giant will no... 
312,2018-11-29T13:43:06+00:00,technology, Cambridge Analytica Knew How You'd Vote If You Wore Wrangler ,https://www.bloomberg.com/news/articles/2018-11-29/cambridge-analytica-knew-how-you-d-vote-if-you-wore-wrangler, messaging.Read More: Facebook Emails Seized by U.K. Said to Number in ’Thousands’Cambridge Analytica collapsed following revelations earlier this year that it had held swathes of Facebook user data after... 
313,2018-11-28T21:30:05+00:00,view," Trump's Mueller Attacks Grow More Desperate, Dangerous ",https://www.bloomberg.com/view/articles/2018-11-28/trump-s-mueller-attacks-grow-more-desperate-dangerous," economic prescriptions of her ilk have fueled the rise of right-wing demagoguery. – Pankaj Mishra Facebook Inc. could help its reputation by being  clearer about where it makes its money, so we can tell... "
314,2018-11-28T17:39:23+00:00,, Facebook Has Race Problem ,https://www.bloomberg.com/news/videos/2018-11-28/facebook-has-race-problem-video," Source: Bloomberg, 00:38  Facebook has a ""black people problem"", says an ex-employee... "
315,2018-11-13T11:53:26+00:00,technology, Investors With $513 Billion Cut Tech Allocations to 2009 Low ,https://www.bloomberg.com/news/articles/2018-11-13/investors-with-513-billion-cut-tech-allocations-to-2009-low," post-crisis bull run.Source: BAMLEven after the shift, long positions in the FAANG quintet of Facebook, Amazon, Apple, Netflix, and Alphabet (the parent of Google) and their Chinese counterparts... "
316,2018-11-12T21:22:24+00:00,, The Blind Spots in Facebook’s Ad Machine (Podcast) ,https://www.bloomberg.com/news/audio/2018-11-12/the-blind-spots-in-facebook-s-ad-machine-podcast," Facebook’s ad platform is quick to learn, easy to use and incredibly profitable. But the complex algorithms that make the ads run are still a black box for most people, and that can create problems—particularly... "
317,2018-11-15T21:00:00+00:00,, Viral Orangutan Ad on Deforestation Slammed by Palm Oil Industry ,https://www.bloomberg.com/news/articles/2018-11-15/viral-orangutan-ad-on-deforestation-slammed-by-palm-oil-industry," destroyed, has been watched more than 4 million times on YouTube and has 15 million views on Facebook, with the hashtag #NoPalmOilChristmas trending on Twitter.The supermarket chain says it’s removing... "
