,Timestamp,Metadata,Headline,URL,ShortDesc
704,2015-06-11T12:00:00+00:00,technology, Oracle Sales Erode as Startups Embrace Souped-Up Free Software ,https://www.bloomberg.com/news/articles/2015-06-11/oracle-sales-eroded-as-startups-embrace-souped-up-free-software," none of the companies indicated this was the case. Others including Alibaba Group Holding Ltd., Facebook Inc., and Google Inc. have even built on MySQL to create their own free variant called WebScaleSQL... "
705,2015-06-10T20:32:48+00:00,, Shopify Merchants to Sell Through Facebook With ‘Buy’ Button ,https://www.bloomberg.com/news/articles/2015-06-10/shopify-merchants-to-sell-directly-on-facebook-with-buy-button, a new feature that would let people buy products from its customers’ stores directly through Facebook Inc. The Ottawa-based software maker said on its blog that a group of merchants who use its... 
706,2015-06-08T20:25:56+00:00,technology," Apple Wants to Own Music Again, and Everyone Is a Target ",https://www.bloomberg.com/news/articles/2015-06-08/apple-wants-to-own-music-again-and-everyone-is-a-target, lengths to talk about how it would keep your data anonymous and never use it the way Google and Facebook will.If you assume there's no upside in having your services know who you are and what you like... 
707,2015-06-05T16:07:40+00:00,technology," Merkel Says Facebook Is ‘Nice,’ Like a Washing Machine ",https://www.bloomberg.com/news/articles/2015-06-05/merkel-says-facebook-is-nice-like-a-washing-machine," “Do you think it’s good that there’s Facebook?” Merkel considered her response. “A lot of people think it’s terrific,” she said. “But it’s not as if Facebook will make you happy in life.” “It’s... "
708,2015-06-03T22:02:51+00:00,technology, Sandberg Ends Period of Mourning for Husband With Facebook Post ,https://www.bloomberg.com/news/articles/2015-06-03/sandberg-ends-period-of-mourning-for-husband-with-facebook-post," Here is Sheryl Sandberg’s Facebook post today marking the loss of her husband David Goldberg, who died in a hotel gym accident May 1 while on vacation in Mexico: Today is the end of sheloshim for... "
709,2015-06-03T21:43:02+00:00,politics, The Definitive H&H Lincoln Chafee Scouting Report ,https://www.bloomberg.com/politics/articles/2015-06-03/the-definitive-h-h-lincoln-chafee-scouting-report, plausible commander-in-chief.Social media/online chops: Derisory 15K followers on Twitter and 6K on Facebook; no Instagram accountMedia coverage: National press has largely ignored him; in rare instances... 
710,2015-05-20T17:23:14+00:00,, China Rivals May Have Scale to Take On Amazon: Stringer ,https://www.bloomberg.com/news/videos/2015-05-20/china-rivals-may-have-scale-to-take-on-amazon-stringer," Chinese rivals may have the scale to threaten companies such as Amazon.com Inc., which along with Facebook Inc., Apple Inc. and Google Inc. is generating ""shareholder value you would never have believed... "
711,2015-04-20T15:58:35+00:00,technology, Why India's Net Neutrality Activists Hate Facebook ,https://www.bloomberg.com/news/articles/2015-04-20/why-india-s-net-neutrality-activists-hate-facebook," than 800,000 letters to the regulatory body.  Facebook CEO Mark Zuckerberg speaks during the Internet.org summit in New Delhi last year.  Facebook CEO Mark Zuckerberg speaks during the Internet... "
712,2015-04-20T04:00:01+00:00,technology, The $320 Billion Bogey Needed to Placate U.S. Stock Market Bulls ,https://www.bloomberg.com/news/articles/2015-04-20/the-320-billion-bogey-needed-to-placate-u-s-stock-market-bulls," months, near the average since 2005 and more than 2 points below the S&P 500.  Facebook, GoogleAnalysts say Facebook will see profit growth of 19 percent and sales expansion of 43 percent in the... "
713,2015-04-17T18:19:59+00:00,technology, Facebook to Offer Services to Internet.org Users ,https://www.bloomberg.com/news/videos/2015-04-17/facebook-to-offer-services-to-internet-org-users," Today’s “BWest Byte” is 39, for the amount of essential services Facebook will offer to Internet.org users. Bloomberg's Cory Johnson reports on “Bloomberg West.” (Source: Bloomberg)... "
714,2015-04-16T14:00:00+00:00,, Andreessen Horowitz Hires Former Facebook General Counsel Ullyot ,https://www.bloomberg.com/news/articles/2015-04-16/andreessen-horowitz-hires-former-facebook-general-counsel-ullyot," hired Ted Ullyot, a former Facebook Inc. general counsel, to build a new policy and regulatory affairs group for the venture capital firm. Ullyot, who was at Facebook from 2008 to 2013, also worked... "
715,2015-04-16T01:17:34+00:00,, Temasek’s Ho Says She’s ‘Well’ Following Sabbatical Announcement ,https://www.bloomberg.com/news/articles/2015-04-16/temasek-s-ho-says-she-s-well-following-sabbatical-announcement," Ho Ching, chief executive officer of Temasek Holdings Pte, said in a Facebook post that she’s “well” and there shouldn’t be concerns following an announcement Wednesday that she’s taking a three-month... "
716,2015-04-07T21:37:53+00:00,technology," Boeing, Rovio, Samsung Display: Intellectual Property ",https://www.bloomberg.com/news/articles/2015-04-07/boeing-rovio-lvmh-samsung-display-intellectual-property," in the case. Several other defendants settled with Rovio earlier. According to Toy Amazon’s Facebook page, the company is a wholesaler and importer for coin-operated vending machine, vending toys... "
717,2015-04-07T06:48:50+00:00,technology," Turkey Lifts Ban on Access to Twitter, Facebook and YouTube ",https://www.bloomberg.com/news/articles/2015-04-07/turkey-lifts-ban-on-access-to-twitter-facebook-and-youtube," to Twitter, Facebook and YouTube after social media websites followed an Istanbul court’s order to remove images of a slain prosecutor that were deemed to abet terrorism. Facebook Inc. and Twitter... "
718,2015-06-25T22:25:02+00:00,technology, Facebook Reports Small Improvement in Diversity ,https://www.bloomberg.com/news/articles/2015-06-25/facebook-reports-minimal-improvement-in-diversity-of-workforce," with 69 percent a year earlier, Facebook said on its website Thursday. The number of white employees fell only slightly, to 55 percent from 57 percent. Facebook has more than 10,000 staff. Silicon... "
719,2015-06-25T10:21:17+00:00,, Hong Kong Regulator Opposes Proposal to Allow Dual-Class Shares ,https://www.bloomberg.com/news/articles/2015-06-25/hong-kong-regulator-opposes-proposal-to-allow-dual-class-shares," shareholders. In the U.S., companies with more than one type of share, including Google Inc. and Facebook Inc., are subject to more stringent reporting requirements and shareholders have the ability... "
720,2015-03-25T12:24:46+00:00,, Ukraine’s President Dismisses Key Governor in ‘Oligarch Crisis’ ,https://www.bloomberg.com/news/articles/2015-03-25/ukraine-s-president-dismisses-key-governor-in-oligarch-crisis-," only protect their influence over the state-owned part of the economy,” Geraschchenko said on Facebook.  Bonds SlideThe country’s bonds dropped for a third day after Moody’s Investors Service cut... "
721,2015-03-24T08:29:26+00:00,technology, India’s Supreme Court Backs Free Speech Online ,https://www.bloomberg.com/news/articles/2015-03-24/free-speech-wins-as-india-scraps-arrests-for-offensive-web-posts, years police have used 66A to arrest people posting controversial opinions on platforms run by Facebook Inc. and Twitter Inc. Tuesday’s ruling follows a Bombay High Court verdict last week saying... 
722,2015-03-23T14:34:02+00:00,technology, EBay Appoints Two Independent Directors Ahead of PayPal Spinoff ,https://www.bloomberg.com/news/articles/2015-03-23/ebay-appoints-two-independent-directors-ahead-of-paypal-spinoff, mobile-payment environment. Companies including Apple Inc. and Google Inc. also have such platforms. Facebook Inc. last week said it would add a payment option through its Messenger app. The spinoff remains... 
723,2015-03-22T12:35:21+00:00,," U.S. Should Consider Arming Ukrainians, Top NATO General Says ",https://www.bloomberg.com/news/articles/2015-03-22/u-s-should-consider-arming-ukrainians-its-top-nato-general," troops clashed near the village Vodyane in the Donetsk region, Ukraine’s Defense Ministry said on Facebook. Two government soldiers were killed and seven wounded in skirmishes Saturday when separatists... "
724,2015-03-19T17:26:24+00:00,, Techonomy’s Kirkpatrick on Tesla and Charging Stations (Audio) ,https://www.bloomberg.com/news/audio/2015-03-19/techonomy-s-kirkpatrick-on-tesla-and-charging-stations-audio-," Vonnie Quinn.  GUEST: David Kirkpatrick, Founder of the Techonomy Conference, and author of ""The Facebook Effect,"" on the Tesla conference call on ""range anxiety,"" and other Tesla news.  This is a Bloomberg... "
725,2015-03-19T13:23:00+00:00,view, Facebook Invades Square and Venmo's Payment Turf ,https://www.bloombergview.com/articles/2015-03-19/facebook-invades-square-and-venmo-s-payment-turf," you coming back to the Facebook ecosystem and that quietly make Facebook an essential nexus.Offering Facebook users a free, easy payments button seems of a piece with this strategy. If it works... "
726,2015-03-19T00:03:02+00:00,politics," Whoa, If True: Obama's Secret Plan to Nuke Charleston, South Carolina ",https://www.bloomberg.com/politics/articles/2015-03-19/whoa-if-true-obama-s-secret-plan-to-nuke-charleston-south-carolina," transfer of nuclear warheads to the East Coast. The story was shared nearly 25,000 times on Facebook, aided by a video introduction by Alex Jones and by a follow-up that quoted South Carolina Senator... "
727,2015-03-13T12:55:35+00:00,view, Benner on Tech: Bitcoin Cold Storage ,https://www.bloombergview.com/articles/2015-03-13/benner-on-tech-bitcoin-cold-storage, Jobs” includes an anecdote in which Tim Cook tried to give an ill Jobs a piece of his liver.Facebook faces a class-action lawsuit over children spending their parents' money on the website without... 
728,2015-03-12T18:31:20+00:00,, Millennials Are More Scared of the Internet Than Anyone Else ,https://www.bloomberg.com/news/articles/2015-03-12/millennials-are-more-scared-of-the-internet-than-anyone-else," Martha Stewart’s pot roast recipes or to wish your cousin’s niece’s brother happy birthday on Facebook, you probably don’t have much to fear. The old cliché applies: Sometimes ignorance is bliss... "
729,2015-03-12T17:59:36+00:00,view, Larry Ellison Has Earned His Sky-High Compensation ,https://www.bloombergview.com/articles/2015-03-12/larry-ellison-has-earned-his-sky-high-compensation," belongs to Google’s Larry Page, who gets paid $1 a year. Other high-profile CEO/founders, such as Facebook’s Mark Zuckerberg, Berkshire Hathaway’s Warren Buffett and Microsoft’s Bill Gates back in the... "
730,2015-03-12T14:31:02+00:00,, New Startups Aren't Keeping Big Mattress Up at Night ,https://www.bloomberg.com/news/articles/2015-03-12/new-startups-aren-t-keeping-big-mattress-up-at-night," all 50 states and in a range of ages (an 82-year-old woman recently found the company via a Facebook referral). “This idea that you have to go and buy a $3,000 to $5,000 mattress to get a good... "
731,2015-03-11T23:40:06+00:00,view, Shiite Militias Also Carry Out Atrocities in Iraq ,https://www.bloombergview.com/articles/2015-03-11/shiite-militias-also-carry-out-atrocities-in-iraq, military. Is it any wonder that members of that military are boasting of their atrocities on Facebook?This column does not necessarily reflect the opinion of Bloomberg View's editorial board or... 
732,2015-03-11T19:15:41+00:00,, Morgan Stanley CEO Says Tone of Markets Improved ,https://www.bloomberg.com/news/videos/2015-03-11/morgan-stanley-ceo-says-tone-of-markets-improved," interview originally aired on Jan. 25, 2012. Source: Bloomberg) 00:00 Market conditions, outlook; Facebook IPO 02:33 Outlook for global economy, Greece 04:22 Capital rules, Dodd-Frank, Volcker Rule 06:12... "
733,2015-03-11T15:04:55+00:00,," Nemtsov Murder Suspects Show Signs of Torture, Council Says ",https://www.bloomberg.com/news/articles/2015-03-11/nemtsov-murder-suspects-show-signs-of-torture-council-says," were “quite convenient” for the authorities by clearing Putin of any involvement. Writing on Facebook, Yashin said Nemtsov “never uttered a bad word about Islam” and focused his criticism on the... "
734,2015-03-10T09:19:06+00:00,, Zambian Kwacha Slumps to 10-Month Low After President’s Collapse ,https://www.bloomberg.com/news/articles/2015-03-10/zambian-kwacha-slumps-to-10-month-low-after-president-s-collapse," in a military hospital and released on Monday, according to a statement on the presidency’s Facebook page The kwacha retreated a fourth day, weakening 1.8 percent to 7.1350 per dollar by 10:44... "
735,2015-03-08T18:55:44+00:00,, Zambian President Treated for Malaria After Taking Ill at Event ,https://www.bloomberg.com/news/articles/2015-03-08/zambian-president-treated-for-malaria-after-taking-ill-at-event," and doctors have ordered him to rest, the State House press office said in a statement on its Facebook account. Agence-France Presse reported that Lungu fell on the podium after standing for about... "
736,2015-03-08T13:47:08+00:00,, Moscow Court Charges Two Suspects in Nemtsov Investigation ,https://www.bloomberg.com/news/articles/2015-03-08/moscow-court-charges-two-suspects-in-nemtsov-investigation," investigators have been put on the wrong scent,” Nemtsov’s ally, Ilya Yashin, said in a statement on his Facebook page following the arrests. Yashin added that high-ranking officials who criticized Nemtsov... "
737,2015-03-08T17:12:03+00:00,, Russian Court Charges Five in Connection With Nemtsov Murder ,https://www.bloomberg.com/news/articles/2015-03-08/russian-court-charges-five-in-connection-with-nemtsov-murder," investigators have been put on the wrong scent,” Nemtsov’s ally, Ilya Yashin, said in a statement on his Facebook page following the arrests Saturday. Yashin added that high-ranking officials who criticized... "
738,2015-03-06T23:41:28+00:00,technology, What to Watch for as Apple Details Reasons to Buy Smartwatches ,https://www.bloomberg.com/news/articles/2015-03-06/four-things-to-watch-for-at-the-apple-watch-event," to the gadget's success, so it's been working with developers from companies including BMW, Facebook and United to have apps ready right out of the box. ""The list of features is a mile long,"" Cook... "
739,2015-03-06T14:06:37+00:00,," Fake Snow, Real Money: The High-Tech Fight to Save California Skiing ",https://www.bloomberg.com/news/features/2015-03-06/fake-snow-real-money-the-high-tech-fight-to-save-california-skiing," winter I’ve ever seen,” China Peak Chief Executive Officer Tim Cohee wrote in an open letter on Facebook. “We have not only dealt with no snow, but also with incredibly marginal snowmaking conditions... "
740,2015-03-03T13:48:34+00:00,view, Want to Run for Congress? Update Your LinkedIn Profile ,https://www.bloombergview.com/articles/2015-03-03/want-to-run-for-congress-update-your-linkedin-profile," candidates itself, and is also urging the public to nominate individuals on its website or through Facebook and Twitter. The job description -- like RFA itself -- purports to be a serious effort. “Much... "
741,2015-09-23T16:42:11+00:00,markets, Exploring the Options Trade on Facebook ,https://www.bloomberg.com/news/videos/2015-09-23/exploring-the-options-trade-on-facebook," MarketTaker.com, examines volatility in the options market and discusses his options strategy on Facebook. He speaks on ""Bloomberg Markets."" (Source: Bloomberg)... "
742,2015-09-22T22:00:00+00:00,, Temasek-Backed Jungle Ventures to Raise $100 Million by Year-end ,https://www.bloomberg.com/news/articles/2015-09-22/temasek-backed-jungle-ventures-to-raise-100-million-by-year-end," their current employers such as Facebook Inc. or Google Inc., according to Gowdey.“You are getting some really interesting founders that maybe had worked at Facebook or Google or some other large... "
743,2015-09-22T21:00:00+00:00,technology," Instagram Hits 400 Million Monthly Users, Mostly Outside U.S. ",https://www.bloomberg.com/news/articles/2015-09-22/instagram-hits-400-million-monthly-users-mostly-outside-u-s-," Facebook Inc.’s Instagram has passed 400 million monthly active users, mostly by adding people in countries outside the U.S.That compares with Twitter Inc.’s 316 million and Pinterest Inc.’s 100... "
744,2015-09-17T21:32:49+00:00,, Drawing Icons and Emoticons for Screens of All Sizes ,https://www.bloomberg.com/news/articles/2015-09-17/drawing-icons-and-emoticons-for-screens-of-all-sizes," Apple designing icons for such classic Mac OS X applications as Mail and iTunes, now works at Facebook, where he helped redesign the company’s ubiquitous “Friends” glyph. (“He’s a very prominent... "
745,2015-09-17T14:47:42+00:00,technology, Facebook to Let Marketers Pay Only If Whole Ads Are Seen ,https://www.bloomberg.com/news/articles/2015-09-17/facebook-to-let-advertisers-pay-only-if-their-whole-ad-is-seen, Facebook Inc. is providing a new option for its more skeptical advertisers.Marketers can now choose to pay Facebook only if their ads have completely passed through a user’s news feed and been... 
746,2015-08-13T22:06:49+00:00,technology, Samsung Loses Bid for Rehearing in Patent Appeal ,https://www.bloomberg.com/news/articles/2015-08-13/samsung-loses-bid-for-rehearing-in-appeal-patent-appeal," fraction of that amount. The Korean handset maker was backed by companies including Google Inc., Facebook Inc. and EBay Inc., who said that the decision gave too much value to designs that covered only... "
747,2015-08-11T22:32:16+00:00,, Takata Sets Campaign to Alert Drivers on Recall for Air-Bag Risk ,https://www.bloomberg.com/news/articles/2015-08-11/takata-sets-campaign-to-alert-drivers-on-recall-for-air-bag-risk," emphasize digital advertising through websites like CNN and Yahoo!, as well as social media like Facebook and Twitter.  Urgent NoticeBanner ads will be in red with the phrase “Urgent Airbag Recall Notice”... "
748,2015-07-13T16:16:01+00:00,, Gun Battle in West Ukraine Sparks Call to Disarm Illegal Groups ,https://www.bloomberg.com/news/articles/2015-07-13/gun-battle-in-west-ukraine-sparks-call-to-disarm-illegal-groups," while 10 more are still hiding, private TV Channel 5 reported. Leader Dmytro Yarosh said on Facebook that the group is “working to stabilize the situation” together with the state security service... "
749,2015-07-10T12:00:03+00:00,technology, Brands Hope You Like Them Enough to Pin Them at the Top of Your Facebook News Feed ,https://www.bloomberg.com/news/articles/2015-07-10/brands-hope-you-like-them-enough-to-pin-them-at-the-top-of-your-facebook-news-feed," A “Like” is no longer enough. Some brands on Facebook can now ask for more devotion from their fans.An update to Facebook's news feed allows users to select a group of preferred friends, whose... "
750,2015-01-29T18:05:42+00:00,technology," So Alibaba, How Do You Monetize Mobile, Asks the Bank That Guided Its IPO ",https://www.bloomberg.com/news/articles/2015-01-29/so-alibaba-how-do-you-monetize-mobile-asks-bank-that-guided-its-ipo, runup to its record-breaking $25 billion initial public offering in September. Companies from Facebook to Alibaba's local Chinese rival Tencent are battling to win customers who increasingly access... 
751,2015-01-28T14:47:08+00:00,technology, Facebook’s Privacy Policy Reviewed by Hamburg Data Regulator ,https://www.bloomberg.com/news/articles/2015-01-28/facebook-s-privacy-policy-reviewed-by-hamburg-data-regulator-i5gttxog, Facebook Inc. is being quizzed by Hamburg’s privacy watchdog amid concerns the social network giant’s revamped user-data policies may violate German law. Facebook was given until the end of the... 
752,2015-01-28T10:45:02+00:00,politics," For Lawyers, a Rocky Walk Down the Gay Marriage Aisle ",https://www.bloomberg.com/politics/features/2015-01-28/for-lawyers-a-rocky-walk-down-the-gay-marriage-aisle," other groups to host fundraisers for them were either dismissed or ignored. “If you look on Facebook or something, you’re constantly being inundated by e-mails and replies from different organizations... "
753,2015-01-27T10:45:35+00:00,, Anti-Islam Protest Fails in Frankfurt as Opponents Rally ,https://www.bloomberg.com/news/articles/2015-01-27/anti-islam-protest-fails-in-frankfurt-as-opponents-rally," one of Pegida’s leaders, stepped down last week after reports that he posed as Adolf Hitler on Facebook. ... "
754,2015-01-26T14:35:58+00:00,view," Benner on Tech: Cablevision, Wi-Fi, Coinbase, and Healthcare.gov ",https://www.bloombergview.com/articles/2015-01-26/benner-on-tech-cablevision-wi-fi-coinbase-and-healthcare-gov," techies, PR people, salesmen and reporters mingle. “I didn’t know what it was, but I saw the Facebook event group and thought I should find out,” a social media professional in pointed heels and... "
755,2015-01-25T21:56:39+00:00,politics, How Long Until Online Ghosts Start Haunting Presidential Candidates? ,https://www.bloomberg.com/politics/articles/2015-01-25/how-long-until-online-ghosts-start-haunting-presidential-candidates-," contender in 2048 probably will have spent their high school years uploading every party picture to Facebook, sometimes making them available for anyone in their high school to access and download. Even... "
756,2015-01-23T15:21:20+00:00,view, Cristina Kirchner Rewrites Alberto Nisman Murder ,https://www.bloombergview.com/articles/2015-01-23/cristina-kirchner-rewrites-alberto-nisman-murder," death a suicide Jan. 19. ""What drives a person to commit such a terrible act?"" she posted on her Facebook. Most everyone else called it murder. Nisman, after all, had just accused Kirchner of trying... "
757,2015-01-23T13:25:08+00:00,technology, Facebook Video Should Worry YouTube: Kevin Roberts ,https://www.bloomberg.com/news/videos/2015-01-23/facebook-video-should-worry-youtube-kevin-roberts," chairman at Saatchi & Saatchi, talk about the White House’s use of social media and YouTube and how Facebook is leading the way in digital video. He speaks on “Bloomberg Surveillance.” (Source: Bloomberg)... "
758,2015-01-21T14:38:53+00:00,view, Benner on Tech: Obama on Surveillance and the DEA on Facebook ,https://www.bloombergview.com/articles/2015-01-21/benner-on-tech-obama-on-surveillance-and-the-dea-on-facebook," report.Independent economists said Deloitte and Facebook used questionable assumptions in the report, valuing each Facebook “Like,” and assigning Facebook credit for roughly one-sixth of smartphone... "
759,2015-01-20T23:33:06+00:00,view, Argentina's Murder Mystery ,https://www.bloombergview.com/articles/2015-01-20/argentina-s-murder-mystery," ""What drives a person to take such a terrible decision to take one's own life?"" she asked on her Facebook page, in a rambling post. Kirchner warned of those who would seize upon the 21-year-old bombing... "
760,2016-01-12T18:38:57+00:00,technology, Uber Wants to Keep You Entertained And Productive During Rides ,https://www.bloomberg.com/news/articles/2016-01-12/uber-wants-to-keep-you-entertained-and-productive-during-rides," with as many third-party apps as possible and cites deals with United Airlines, StubHub and Facebook’s Messenger as ways that Uber has made it convenient for people to book a ride while doing something... "
761,2016-01-12T11:19:24+00:00,, Central Bankers Enjoy Twitter Party as Followers Jump by Half ,https://www.bloomberg.com/news/articles/2016-01-12/central-bankers-enjoy-twitter-party-as-followers-jump-by-half," counterpart’s 14,086.Elsewhere on social media, 53 central banks had a YouTube channel, while 46 used Facebook, Central Banking Publications said.For their part, Fed and Bank of England officials have both... "
762,2016-01-14T13:00:12+00:00,, You Can Be an Idiot on Social Media and Still Get Into College ,https://www.bloomberg.com/news/articles/2016-01-14/you-can-be-an-idiot-on-social-media-and-still-get-into-college," colleges surveyed by Kaplan said they had “visited an applicant's social networking page like Facebook, Twitter or LinkedIn to learn more about them,” compared with 10 percent in 2008, the vast majority... "
763,2016-01-14T11:55:44+00:00,markets, Does the Corporate Bond Market Have a ‘FANG’ Problem? ,https://www.bloomberg.com/news/articles/2016-01-14/does-the-corporate-bond-market-have-a-fang-problem-," dominant stocks were responsible for rescuing the U.S. equities market last year.The ability of Facebook Inc., Amazon.com Inc., Netflix Inc., and Google Inc. (now Alphabet Inc.)—known as ‘FANG’—to... "
764,2016-01-14T11:00:00+00:00,technology, Anaplan Valued at $1.1 Billion After $90 Million Pre-IPO Round ,https://www.bloomberg.com/news/articles/2016-01-14/anaplan-valued-at-1-1-billion-after-90-million-pre-ipo-round," computer systems, selling software it says is simpler to use and less clunky. Companies from Facebook Inc. to Google Inc. are also going after the enterprise market with offers for work.""We’ve just... "
765,2016-01-13T16:57:21+00:00,, Azeris Protest Price Increases as Currency Slumps to Record ,https://www.bloomberg.com/news/articles/2016-01-13/azeris-protest-against-price-increases-as-manat-drops-to-record," flour, unemployment,” Ali Karimli, leader of the People’s Front of Azerbaijan Party, said on Facebook. “Instead of sending riot police, the government needs to listen to people,” said Karimli, whose... "
