,Timestamp,Metadata,Headline,URL,ShortDesc
260,2017-08-08T10:00:57+00:00,politics," Balance of Power: Chaos, Change and Two Crucial Votes in Africa ",https://www.bloomberg.com/politics/articles/2017-08-08/balance-of-power-chaos-change-and-two-crucial-votes-in-africa," the Balance of Power newsletter in your inbox, and follow Bloomberg Politics on Twitter and Facebook for more.Global HeadlinesTrump's next big push | Overhauling the tax code is President Donald... "
261,2017-08-07T20:17:24+00:00,technology, CBS Bucks Advertising Downdraft With Gains From NCAA Finals ,https://www.bloomberg.com/news/articles/2017-08-07/cbs-bucks-advertising-downdraft-with-gains-from-ncaa-finals," or for reruns in the U.S.. The company last week hired David Lawenda, a former executive at Facebook and Univision, to boost advertising sales online.Profit for the second quarter rose to 97 cents... "
262,2017-08-07T14:10:16+00:00,, Anders Borg Resigns as Senior Advisor for Citi After Scandal ,https://www.bloomberg.com/news/articles/2017-08-07/anders-borg-resigns-as-senior-advisor-for-citi-after-scandal," under police investigation and said on Aug. 5 on his Facebook page that he couldn’t comment on the situation further. “My apology on Facebook was because I had behaved unpleasantly,” he said. “It... "
263,2017-08-15T22:22:12+00:00,technology, Bleacher Report CEO Says Facebook Relations Complicated ,https://www.bloomberg.com/news/videos/2017-08-15/bleacher-report-ceo-facebook-relations-complicated-video," and chief executive officer, discusses the company's content strategy and relationship with Facebook. He speaks with Bloomberg's Scarlet Fu on ""What'd You Miss?""... "
264,2017-08-15T20:30:07+00:00,view, The Daily Prophet: Red-Hot Tech Stocks Lose Some Big Supporters ,https://www.bloomberg.com/view/articles/2017-08-15/the-daily-prophet-red-hot-tech-stocks-lose-some-big-supporters," the so-called smart money starts to pull away from this exclusive club known as the FAANGs -- Facebook Inc., Apple Inc., Amazon.com Inc., Netflix Inc. and Google parent Alphabet Inc.That’s the takeaway... "
265,2017-08-11T09:00:00+00:00,, Corporate America Is Having Its Best Earnings Season in 13 Years ,https://www.bloomberg.com/news/articles/2017-08-11/boost-from-abroad-gives-u-s-companies-best-quarter-since-2004," and that’s what shows up in the top-line results, particularly in technology,” Paulsen said.Facebook beat earnings and sales estimates in the quarter as advertising revenue jumped 50 percent on... "
266,2017-08-11T08:00:06+00:00,, Hollywood’s Summer From Hell ,https://www.bloomberg.com/news/articles/2017-08-11/hollywood-s-summer-from-hell," get one solid weekend of sales before a poor reputation caught up to it on Monday. Twitter and Facebook, however, have shortened that window to the point where a film like “King Arthur: Legend of... "
267,2017-08-10T22:46:23+00:00,technology, Facebook Revamps Video Platform With New 'Watch' Section ,https://www.bloomberg.com/news/videos/2017-08-10/facebook-revamps-video-platform-introduces-watch-video," Facebook Inc. will introduce a new video hub on the world’s largest social network Thursday, offering... "
268,2017-08-14T12:30:07+00:00,view, The Tracks of Democratic Tears ,https://www.bloomberg.com/view/articles/2017-08-14/the-tracks-of-democratic-tears," Votes Swung Democratic Party Chair Election to Bauman,"" states a June press release on Ellis's Facebook page.I have no capacity to judge whether Ellis's collection of accusations -- ""1 vote from a... "
269,2017-06-28T02:28:03+00:00,technology, Ransomware Cyberattack Goes Global ,https://www.bloomberg.com/news/articles/2017-06-28/cyberattack-reaches-asia-as-new-targets-hit-by-ransomware-demand," biggest in Ukraine’s history,” Anton Gerashchenko, an aide to the Interior Ministry, wrote on Facebook. Kyivenergo, a Ukrainian utility, switched off all computers after the hack, while another power... "
270,2017-06-27T12:21:59+00:00,technology, Google Fined $2.7 Billion as EU Threatens Search Monopoly ,https://www.bloomberg.com/news/articles/2017-06-27/google-gets-record-2-7-billion-eu-fine-for-skewing-searches," shopping searches, one of its biggest sources of sales growth and strongest weapons against rivals Facebook Inc. and Amazon.com Inc.Read more: For an analysis, replay our TOPLive blog on the EU Google... "
271,2017-06-27T06:30:10+00:00,, Brexit Bulletin: Citizenship Test for May ,https://www.bloomberg.com/news/articles/2017-06-27/brexit-bulletin-citizenship-test-for-may," com/George_Osborne/status/879324865983131650        For more on Brexit follow Bloomberg on Twitter, Facebook and Instagram... "
272,2017-06-26T06:35:12+00:00,," Bloomberg Brexit Bulletin: David Davis, Liam Fox, Tory plots, FTSE 100 ",https://www.bloomberg.com/news/articles/2017-06-26/bloomberg-brexit-bulletin-david-davis-liam-fox-tory-plots-ftse-100," process. Franz Wild reports on his latest views. For more on Brexit follow Bloomberg on Twitter, Facebook and Instagram... "
273,2017-06-24T00:49:53+00:00,technology," Unilever Grills Tech Giants on Ads, Says Dollars Up for Grabs ",https://www.bloomberg.com/news/articles/2017-06-24/unilever-grills-tech-giants-on-ads-says-dollars-up-for-grabs," reporting how ads are performing, a challenge to dominant players such as Alphabet Inc.’s Google and Facebook Inc.“I’m making it really clear, over and over again,’’ said Keith Weed, Unilever’s chief marketing... "
274,2017-06-23T05:31:31+00:00,, New Zealand Newspaper Names All Drunk Drivers on Front Page ,https://www.bloomberg.com/news/articles/2017-06-23/new-zealand-newspaper-names-all-drunk-drivers-on-front-page," have been strong reactions both for and against the campaign. That was reflected on the paper's Facebook page. One commenter wrote: ""Are you absolutely kidding me? What about their children,"" while... "
275,2017-06-22T16:29:45+00:00,technology, Digital Celebrities Rely On New Trade Group to Set Ad Disclosure Rules ,https://www.bloomberg.com/news/articles/2017-06-22/digital-celebrities-rely-on-new-trade-group-to-set-ad-disclosure-rules," Influencer marketing has become more widespread, with more than 200,000 such posts a month just on Facebook Inc.'s Instagram, according to Captiv8, one of the groups on the new council. About half of... "
276,2017-06-22T12:00:06+00:00,businessweek, Reno Is Starting to Look More Like Silicon Valley ,https://www.bloomberg.com/news/articles/2017-06-22/reno-is-starting-to-look-more-like-silicon-valley," level up is $17. A technician starts at about $23 an hour, Panasonic tells applicants on its Facebook page. Nevadans can enroll at Truckee Meadows Community College in a free training program on... "
277,2017-06-22T09:59:01+00:00,politics, Balance of Power: The Yellen Wild Card ,https://www.bloomberg.com/politics/articles/2017-06-22/balance-of-power-the-yellen-wild-card," the Balance of Power newsletter in your inbox, and follow Bloomberg Politics on Twitter and Facebook for more.Global HeadlinesSenate unveils Obamacare plan  | Republican leaders will unveil a closely... "
278,2017-06-21T09:42:11+00:00,, Saudi shakeup; costliest cities: Your Evening Briefing Asia ,https://www.bloomberg.com/news/articles/2017-06-21/saudi-shakeup-costliest-cities-your-evening-briefing-asia, lose—billionaire status.The very public feud of Singapore's first family. A tit-for-tat row on Facebook? Probably not something you'd expect from the wealthy family of Singapore's Prime Minister Lee... 
279,2017-06-21T00:19:00+00:00,technology, Sony Introduces Robot Toy as Recovery Takes Root ,https://www.bloomberg.com/news/articles/2017-06-21/sony-introduces-robot-toy-as-recovery-takes-root," receive the Fully Charged newsletter in your inbox, and follow Bloomberg Technology on Twitter and Facebook for more.And here's what you need to know in global technology newsTesla is moving into China... "
280,2017-06-20T07:36:31+00:00,politics, Ukrainian Leader to Get First Trump Meeting With ‘Drop-In’ ,https://www.bloomberg.com/politics/articles/2017-06-20/ukrainian-leader-to-get-first-trump-meeting-at-drop-in-tuesday," like to improve ties.“Ukraine has fantastic support in the U.S.,” Poroshenko said Tuesday on Facebook. “And it’s very important that my meeting in the White House will be earlier than Putin’s. It’s... "
281,2017-06-19T21:29:43+00:00,technology, Sandberg Says 70 Million Small Businesses Using Facebook ,https://www.bloomberg.com/news/videos/2017-06-19/sandberg-says-70m-small-businesses-using-facebook-video," Facebook Chief Operating Officer Sheryl Sandberg discusses how small businesses use Facebook services with Bloomberg's Caroline Hyde on ""Bloomberg... "
282,2017-06-18T21:15:45+00:00,, U.S. Navy Stops Search for 7 Missing Sailors After Bodies Found ,https://www.bloomberg.com/news/articles/2017-06-18/urgent-navy-stops-search-for-7-missing-sailors-after-bodies-found," 20-year-old son, Bruce Adkison, a fifth-generation sailor, survived the collision, said in a Facebook message that families are grieving for those who died and trying to get clothing and other items... "
283,2017-06-16T19:06:51+00:00,view, The Web Makes It Harder to Read Market Sentiment ,https://www.bloomberg.com/view/articles/2017-06-16/the-web-makes-it-harder-to-read-market-sentiment,"  ""deflation"" or ""monetary debasement.""The financial crisis brought out the worst offenders. Facebook groups and financial Twitter has emboldened many. The internet has given their voice a global... "
284,2017-06-16T11:00:13+00:00,technology, Uber’s CEO Found an Unhappy Compromise ,https://www.bloomberg.com/news/articles/2017-06-16/uber-s-ceo-found-an-unhappy-compromise," receive the Fully Charged newsletter in your inbox, and follow Bloomberg Technology on Twitter and Facebook for more.And here’s what you need to know in global technology newsAn Amazon-Slack deal could... "
285,2017-06-14T22:37:22+00:00,technology," IEX Deepens Silicon Valley Ties, Adding Snap Chair to Its Board ",https://www.bloomberg.com/news/articles/2017-06-14/iex-deepens-silicon-valley-ties-adding-snap-chair-to-its-board," statement. The exchange operator is backed by Iconiq Capital, a multifamily office which counts Facebook Inc. CEO Mark Zuckerberg as a client.“His long track record of successfully leading public companies... "
286,2017-06-14T15:01:51+00:00,, Popular 401(k) Funds Are Packed With Tech Stocks ,https://www.bloomberg.com/news/articles/2017-06-14/popular-401-k-funds-are-packed-with-tech-stocks," you? Recent volatility in popular technology stocks, including Apple Inc., Microsoft Corp., Facebook Inc., Google parent Alphabet Inc., and others, is a reminder to check the tech weighting in... "
287,2017-06-14T02:00:00+00:00,politics, Now Even Turkish Millionaires Are Fleeing Erdogan's Crackdown ,https://www.bloomberg.com/politics/articles/2017-06-14/best-and-brightest-turks-go-west-as-erdogan-s-purge-shows-no-end," and others he knows of have left the country to work at companies including Amazon.com Inc., Facebook Inc., Spotify Ltd., TripAdvisor Inc. and Booking.com, which is banned in Turkey.“In the past... "
288,2017-06-13T19:11:03+00:00,gadfly, Looking for Someone to Blame for Uber? Look in the Mirror ,https://www.bloomberg.com/gadfly/articles/2017-06-13/looking-for-someone-to-blame-for-uber-look-in-the-mirror," about the people who assemble iPhones working under grueling conditions. We might joke about Facebook's hoovering up all the data about us, even to the point of revealing who else is seeing our shrink... "
289,2017-06-13T06:00:10+00:00,businessweek, The Limits of Artificial Intelligence ,https://www.bloomberg.com/news/articles/2017-06-13/the-limits-of-artificial-intelligence," after pranksters pushed it to make racist, sexist and pornographic remarks. Earlier this year, Facebook went back to the drawing board after its bots hit a failure rate of 70 percent, according to... "
290,2017-05-18T09:00:07+00:00,businessweek," The Barbarians Are at Etsy’s Hand-Hewn, Responsibly Sourced Gates ",https://www.bloomberg.com/news/features/2017-05-18/the-barbarians-are-at-etsy-s-hand-hewn-responsibly-sourced-gates, community loom.And then there are the perks. Etsy offers a more generous parental leave policy than Facebook Inc. or Google Inc.—six months for both parents—along with free crafts classes and what has... 
291,2017-05-18T08:47:55+00:00,, May Promises to Fight `Elites' as She Rejects U.K. Orthodoxy ,https://www.bloomberg.com/news/articles/2017-05-18/may-promises-to-fight-elites-as-she-rejects-u-k-orthodoxy," life is still determined by where you were born and to whom,” the prime minister wrote in a Facebook post ahead of the publication of her Conservative Party’s election manifesto at around 11 a... "
292,2017-05-17T21:52:49+00:00,technology, What You Should Care About From Google's I/O Conference ,https://www.bloomberg.com/news/articles/2017-05-17/what-you-should-care-about-from-google-s-i-o-conference, regular cell number from Google Home. Google wants to take VR mainstream with standalone headsets: Facebook Inc.'s Oculus Rift and HTC Corp.'s Vive are cool products. They let you fully immerse yourself... 
293,2017-05-17T18:27:25+00:00,technology, Facebook Said to Face European Union Fine Over WhatsApp Deal ,https://www.bloomberg.com/news/articles/2017-05-17/facebook-said-to-face-european-union-fine-over-whatsapp-deal-j2tbktiu, Commissioner Margrethe Vestager targeted Facebook after it announced privacy policy changes in August that would allow the advertising platforms on Facebook and Instagram to draw upon data from WhatsApp... 
294,2017-05-26T13:48:35+00:00,view, VIX Hedging and College Sports ,https://www.bloomberg.com/view/articles/2017-05-26/vix-hedging-and-college-sports," argues (on Twitter, and in the Bloomberg Markets newsletter) for a Facebook Inc. currency:Imagine, for a second, if Facebook not only launched its own currency (""Facebucks"") but imposed a tax every... "
295,2017-05-24T17:00:00+00:00,markets, S&P's Famous FANG Trade Has Nothing on Chinese Four-Stock Frenzy ,https://www.bloomberg.com/news/articles/2017-05-24/s-p-s-famous-fang-trade-has-nothing-on-chinese-four-stock-frenzy," the U.S., the FANG block of Facebook Inc., Amazon.com Inc., Netflix Inc. and Google parent Alphabet Inc. trailed the market last year for the first time since Facebook’s initial share sale in 2012... "
296,2017-05-24T15:14:08+00:00,view, So Much for IBM's Bright Idea on Remote Work ,https://www.bloomberg.com/view/articles/2017-05-24/so-much-for-ibm-s-bright-idea-on-remote-work," because of the explosive growth of the technology sector over the past 20 years. Apple, Google, Facebook, Netflix, Tesla, Uber and others have created products and companies that are the envy of the... "
297,2017-06-03T17:32:30+00:00,, Pop Star Ariana Grande Visits Fans At Manchester Hospital ,https://www.bloomberg.com/news/articles/2017-06-03/pop-star-ariana-grande-visits-fans-in-hospital," daughter Jaden was injured in the attack, posted several photos of Grande and the youngster on Facebook. ""So happy she came i could burst!,"" he wrote. ""Never seen jaden so happy! even cried again... "
298,2017-06-02T10:00:23+00:00,, Puerto Rico’s Exodus Is Speeding the Island’s Economic Collapse ,https://www.bloomberg.com/news/articles/2017-06-02/-i-had-to-choose-for-my-family-thousands-fleeing-puerto-rico," care of those kids anymore,’’ said Navas Nazario, who keeps in touch with former patients on Facebook. “You have to make a hard decision to leave relationships with friends and family just to get... "
299,2017-06-02T10:00:58+00:00,politics, Balance of Power: Trump Alone ,https://www.bloomberg.com/politics/articles/2017-06-02/balance-of-power-trump-alone," the Balance of Power newsletter in your inbox, and follow Bloomberg Politics on Twitter and Facebook for more.Chinese President Xi Jinping attends a ceremony inside the Great Hall of the People... "
300,2017-11-09T10:11:38+00:00,politics, Facebook And Twitter Are the Newest Battlegrounds in Brazil’s Election ,https://www.bloomberg.com/politics/articles/2017-11-09/facebook-and-twitter-are-newest-battlegrounds-in-brazil-election," ramping up social media presence as they brace for a tight race with shrinking financial resources.Facebook, Twitter, Instagram and YouTube are poised to play outsized roles in the first presidential... "
301,2017-11-08T16:37:53+00:00,politics," Russian Hackers Fueled Catalan Separatism, Madrid Institute Says ",https://www.bloomberg.com/politics/articles/2017-11-08/russian-hackers-fueled-catalan-separatism-madrid-institute-says," research institute in Madrid.The unidentified Russians spread both true and false messages on Facebook and Twitter during the illegal separatist referendum on Oct. 1, according to Mira Milosevich... "
302,2017-11-08T06:39:08+00:00,politics," Trump Starts China Visit Seeking Progress on Trade, North Korea ",https://www.bloomberg.com/politics/articles/2017-11-08/trump-starts-china-visit-seeking-progress-on-trade-north-korea, group of U.S. executives in Beijing -- including Apple Inc. Chief Executive Officer Tim Cook and Facebook Inc. founder Mark Zuckerberg-- that he would “continue issuing a series of measures to further... 
303,2017-11-08T04:43:25+00:00,politics, Trump Tweets From China ,https://www.bloomberg.com/politics/articles/2017-11-08/to-tweet-or-not-to-tweet-is-the-question-as-trump-visits-china, down on the practice.China has occasionally allowed brief access to social media sites like Facebook and Twitter when it hosts international summits. And Chinese President Xi Jinping’s government... 
304,2017-11-07T16:17:29+00:00,markets, This Tech ETF Beats the Competition When Earnings Roll Around ,https://www.bloomberg.com/news/articles/2017-11-07/this-tech-etf-beats-the-competition-when-earnings-roll-around," Technology ETF (RYT). But not during earnings season. Why? Because Apple Inc., Microsoft Corp., Facebook Inc. and Google parent Alphabet Inc. make up almost 40 percent of the cap-weighted fund. So... "
305,2017-11-07T07:50:59+00:00,, Brexit Bulletin: Business Despairs ,https://www.bloomberg.com/news/articles/2017-11-07/brexit-bulletin-business-despairs," tourist sights.Photographer: Pau Barrena/BloombergFor more on Brexit follow Bloomberg on Twitter, Facebook and Instagram... "
306,2017-11-07T04:00:00+00:00,technology, Vice's Blunt-Smokers Expand Where Marijuana Can Get You Killed ,https://www.bloomberg.com/news/articles/2017-11-07/vice-s-blunt-smokers-expand-where-marijuana-can-get-you-killed," that has bedeviled many Western companies. Walt Disney Co., Netflix Inc., Alphabet Inc. and Facebook Inc. have all run into issues of censorship and other regulatory headaches.The most visible... "
307,2017-11-07T00:00:01+00:00,politics," Triumphant in Sicily, Berlusconi Faces Pitfalls on Way to Rome ",https://www.bloomberg.com/politics/articles/2017-11-07/triumphant-in-sicily-berlusconi-faces-pitfalls-on-way-to-rome," for the premiership, pulled out of a television debate with Renzi due Tuesday, writing in a Facebook post that after “the earthquake of the vote in Sicily,” Renzi was no longer the Democrat candidate... "
308,2017-11-06T12:00:09+00:00,technology, Lawmakers Have the Internet in Their Sights ,https://www.bloomberg.com/news/articles/2017-11-06/lawmakers-have-the-internet-in-their-sights, wielded by companies like Facebook and Google. China is shutting down virtual private networks that people use to get around censorship for accessing YouTube or Facebook. U.S. Federal Communications... 
309,2017-11-04T19:48:07+00:00,politics, McConnell Says Silicon Valley Should Help the U.S. Retaliate Against Russia ,https://www.bloomberg.com/politics/articles/2017-11-04/mcconnell-to-silicon-valley-uncle-sam-wants-you-for-russia-help," Mitch McConnell’s call comes after lawmakers in Washington spent days grilling top lawyers from Facebook Inc., Twitter Inc., and Alphabet Inc.’s Google over how their platforms were used by Russian... "
310,2017-11-04T21:35:49+00:00,politics," Early Facebook Backer Tied to Russia Bank, Kushner Platform ",https://www.bloomberg.com/politics/articles/2017-11-04/early-backer-of-facebook-linked-to-russia-bank-kushner-platform," A prominent Silicon Valley investor who was an early backer of Facebook Inc. partnered in two investments with the Russian state-controlled bank VTB Bank PJSC before it was sanctioned, his spokesman... "
311,2017-12-08T17:00:00+00:00,technology, Facebook Offers Its Harassment Policy as a Guide for Tech Firms ,https://www.bloomberg.com/news/articles/2017-12-08/facebook-offers-its-own-harassment-policy-as-a-guide-tech-firms," people Lori Goler. Earlier this week, Facebook was named the best place to work by Glassdoor, a job site that asks employees to rate their company.Facebook posted its policy on the company’s site... "
312,2017-12-08T17:46:39+00:00,view, Bitcoin Swings and Tax Glitches ,https://www.bloomberg.com/view/articles/2017-12-08/bitcoin-swings-and-tax-glitches," ""ambiance and atmosphere models"" in Silicon Valley:Local modeling agencies, which work with Facebook- and Google-size companies as well as much smaller businesses and the occasional wealthy individual... "
313,2017-12-08T07:50:21+00:00,, Brexit Bulletin: Breakthrough Before Breakfast ,https://www.bloomberg.com/news/articles/2017-12-08/brexit-bulletin-breakthrough-before-breakfast," London.Photographer: Luke MacGregor/BloombergFor more on Brexit follow Bloomberg on Twitter, Facebook and Instagram... "
314,2017-12-08T03:00:09+00:00,businessweek, Will Cape Town Run Out of Water? ,https://www.bloomberg.com/news/features/2017-12-08/will-cape-town-run-out-of-water," Swiegers/BloombergThe water shortage has become staple dinner-table and radio talk show conversation, and a Facebook group on how to save water and prepare for outages has drawn more than 121,000 followers. Rainwater-tank... "
315,2017-12-06T22:25:08+00:00,technology, Bitcoin Mining Service NiceHash Says Hackers Emptied Its Wallet ,https://www.bloomberg.com/news/articles/2017-12-06/bitcoin-mining-service-nicehash-says-hackers-emptied-its-wallet," to verify the precise number of BTC taken,” the company said Wednesday in a statement on its Facebook page. It’s halting operations for 24 hours, it said. The venture’s main webpage showed a “maintenance”... "
316,2017-12-06T05:00:01+00:00,markets," Tencent Seen Doubling by Stock-Picker Who's Already Up 6,000% ",https://www.bloomberg.com/news/articles/2017-12-06/tencent-seen-doubling-by-stock-picker-who-s-already-up-6-000," firm BDA China Ltd., told Bloomberg News at the time.Read more: Why Tencent wants to be like Facebook in advertisingThen there’s valuation. Mitchell Kim, an analyst with Maybank Kim Eng Securities... "
317,2017-12-05T20:09:16+00:00,technology, Charlie Ergen’s Job Change Points to Dish’s Costly Network Plan ,https://www.bloomberg.com/news/articles/2017-12-05/billionaire-ergen-s-job-change-points-to-costly-network-plan," current wireless carrier to build a network, or to work with a “tenant” such as Amazon.com Inc. or Facebook Inc. to provide services to their customers.The possibility of lining up a partner remains open... "
318,2017-12-04T09:24:54+00:00,politics," Home From Exile, Shafiq Reconsidering Egyptian Presidential Bid ",https://www.bloomberg.com/politics/articles/2017-12-04/home-from-exile-shafiq-reconsidering-egyptian-presidential-bid," said they feared he had been kidnapped by the authorities.His lawyer, Dina Adly, later said on Facebook that she had seen the former air force pilot. Soon after, he spoke by telephone to Dream Television... "
319,2017-12-01T12:42:41+00:00,technology, Gadgets with Gurman: Hands-On With the Surface Book 2 ,https://www.bloomberg.com/news/videos/2017-12-01/gadgets-with-gurman-hands-on-with-surface-book-2-video," laptop. Mark will also take questions from the audience. Watch every Wednesday on Bloomberg.com, Facebook and Twitter. ... "
320,2017-12-01T11:16:15+00:00,politics, Balance of Power: Everything at Stake Today in Senate Tax Vote ,https://www.bloomberg.com/politics/articles/2017-12-01/balance-of-power-everything-at-stake-today-in-senate-tax-vote," the Balance of Power newsletter in your inbox, and follow Bloomberg Politics on Twitter and Facebook for more.Global HeadlinesU.S. ramps up China criticism | The Trump administration accused China... "
321,2017-12-01T04:12:47+00:00,markets, Tencent Drops Suddenly as Shares Set for Worst Week in 21 Months ,https://www.bloomberg.com/news/articles/2017-12-01/tencent-drops-suddenly-as-shares-set-for-worst-week-in-21-months," November, adding 14 percent as its market capitalization exceeded $500 billion and topped that of Facebook Inc.“Tencent is tracking losses in the global technology sector,” said Julia Pan, a Shanghai-based... "
322,2017-11-30T01:45:16+00:00,, Global Trade Boom Steams Into 2018 as Trump Threatens Barriers ,https://www.bloomberg.com/news/articles/2017-11-30/global-trade-boom-steams-into-2018-as-trump-threatens-barriers," Yerxa, president of the National Foreign Trade Council, whose members range from Coca-Cola to Facebook. “That’s really the lesson the U.S. has to draw. It’s easy to hate some system rules. The question... "
323,2017-11-29T15:31:15+00:00,politics," A Guide to Britain First, the Anti-Islam Group Trump Retweeted ",https://www.bloomberg.com/politics/articles/2017-11-29/britain-first-group-re-tweeted-by-trump-pushes-anti-islam-agenda," through immigration."" It also claims to be a Christian organization, according to its website and Facebook page.The killer of Jo Cox, a lawmaker murdered during the campaign for last year’s European... "
