,Timestamp,Metadata,Headline,URL,ShortDesc
825,2018-04-25T09:00:17+00:00,businessweek, Billionaire Tom Steyer’s Quest to Impeach Trump ,https://www.bloomberg.com/news/features/2018-04-25/billionaire-tom-steyer-s-quest-to-impeach-trump, Applause broke out. He smiled and locked eyes with people around the room. Fans following the Facebook livestream sent thumbs-ups by the thousands as he and the five speakers set about explaining... 
826,2018-04-26T19:23:09+00:00,technology, Cambridge Who? Facebook Recoups Most of Data-Crisis Share Slump ,https://www.bloomberg.com/news/articles/2018-04-26/cambridge-who-facebook-recoups-most-of-data-crisis-share-slump," political consulting firm Cambridge Analytica had obtained information on millions of Facebook users.Facebook’s market value is now $508 billion, just $30 billion shy of the $538 billion pre-crisis... "
827,2018-04-26T11:04:03+00:00,markets, The Bulls Need to Have Their Pulses Checked Pronto: Taking Stock ,https://www.bloomberg.com/news/articles/2018-04-26/the-bulls-need-to-have-their-pulses-checked-pronto-taking-stock," Some of the earnings-fueled lift in stock futures overnight has faded, even with Facebook shares up over 6% and yields pulling back: 10-year returns to the shiny 3.00% mark, after hitting 3.03%... "
828,2018-04-26T09:00:12+00:00,businessweek, New Breed of Shoppers Races to Instagram to Buy Vintage Clothes ,https://www.bloomberg.com/news/articles/2018-04-26/new-breed-of-shoppers-races-to-instagram-to-buy-vintage-clothes," businesses by others—represent a burgeoning corner of social commerce. Though networks such as Facebook, Twitter, Pinterest, and Instagram can heavily influence purchases, transactions happen mostly... "
829,2018-03-18T15:56:40+00:00,, Facebook bans Cambridge Analytica ,https://www.bloomberg.com/news/videos/2018-03-18/facebook-bans-cambridge-analytica-video, Facebook has suspended the account of the data firm that helped Trump win the presidential election as... 
830,2018-04-09T20:04:05+00:00,markets," CalSTRS 'Very Unhappy' With Facebook Governance, CIO Says ",https://www.bloomberg.com/news/videos/2018-04-09/calstrs-very-unhappy-with-facebook-governance-cio-says-video," Retirement System chief investment officer, discusses his decision to deactivate his personal Facebook account and the social-media company's response to its data privacy crisis. He speaks with Bloomberg's... "
831,2018-04-09T19:46:14+00:00,markets," Facebook Crisis Fueled by Zuckerberg’s Star Status, CalSTRS CIO Says ",https://www.bloomberg.com/news/articles/2018-04-09/ailman-says-facebook-crisis-fueled-by-zuckerberg-star-status," Chris Ailman discusses Facebook’s response to its data privacy crisis.(Source: Bloomberg)Ailman, 59, recently captured attention after deactivating his personal Facebook account last week, joining... "
832,2018-04-09T14:43:35+00:00,," Surveillance: China is in a Sweet Spot, Lord Turner Says ",https://www.bloomberg.com/news/audio/2018-04-09/surveillance-china-is-in-a-sweet-spot-lord-turner-says," Bloomberg Intelligence Director of North American Research, says data privacy is not just a Facebook issue, it’s a social media issue. This is a Bloomberg podcast. To download, watch or listen... "
833,2018-04-09T06:30:34+00:00,, Brexit Bulletin: The Road to Another Referendum ,https://www.bloomberg.com/news/articles/2018-04-09/brexit-bulletin-the-road-to-a-second-referendum," Photographer: Matt Cardy/Getty Images EuropeFor more on Brexit follow Bloomberg on Twitter, Facebook and Instagram... "
834,2018-04-09T12:19:10+00:00,technology, Alibaba’s Jack Ma Challenges Mark Zuckerberg to ‘Fix’ Facebook ,https://www.bloomberg.com/news/articles/2018-04-09/alibaba-s-jack-ma-challenges-mark-zuckerberg-to-fix-facebook," about the Facebook furor, the billionaire started dismissing questions but then couldn’t help opining on the crisis facing the U.S. company.Jack MaPhotographer: Qilai Shen/BloombergFacebook’s shares... "
835,2018-04-06T20:31:17+00:00,, Your Evening Briefing ,https://www.bloomberg.com/news/articles/2018-04-06/your-evening-briefing," excessively tight.” Friday’s jobs report showed wages beginning to rise as hiring cooled in March.Facebook will soon let you retract messages, after CEO Mark Zuckerberg was caught using an early version... "
836,2018-04-06T18:39:07+00:00,view, Stingray Devices in Washington Aren't Alone in Spying on Phones ,https://www.bloomberg.com/view/articles/2018-04-06/stingray-devices-in-washington-aren-t-alone-in-spying-on-phones," may not have spent much time perusing Facebook’s terms of service. The challenge for the privacy-conscious user isn’t third parties; the challenge is Facebook itself, which exists not to connect... "
837,2018-04-06T18:00:13+00:00,technology, Facebook Rolls Out Plan to Battle Fake Ads With More Disclosure ,https://www.bloomberg.com/news/articles/2018-04-06/facebook-rolls-out-plan-to-battle-fake-ads-with-more-disclosure," through those steps won’t be able to run either type, Zuckerberg said in a Facebook post.New political adsSource: FacebookFacebook will hire more people to make the change before the 2018 midterm elections... "
838,2018-04-06T17:56:06+00:00,markets, A $1.4 Billion Hedge Fund Is Looking Past Facebook’s Data Troubles ,https://www.bloomberg.com/news/articles/2018-04-06/bannasch-s-1-4-billion-hedge-fund-looks-past-media-facebook-hit," Facebook Inc. may be under global scrutiny amid a data breach scandal, but its fundamentals remain intact.Such is the thinking of Eric Bannasch, the founder of the $1.4 billion hedge fund Cadian... "
839,2018-04-06T09:00:12+00:00,technology, Facebook’s Data Crackdown Has Two Winners: Facebook and Google ,https://www.bloomberg.com/news/articles/2018-04-06/facebook-s-data-crackdown-has-two-winners-facebook-and-google," partnerships, which tap outside data to reach Facebook users, are different than the Cambridge Analytica episode, where internal Facebook data leaked out.Facebook had another program that let advertisers... "
840,2018-03-20T19:22:42+00:00,technology, A Facebook Legal Executive Briefed Employees on the Data Leak ,https://www.bloomberg.com/news/articles/2018-03-20/facebook-legal-executive-is-said-to-brief-employees-on-data-leak," president and deputy general counsel at Facebook, spoke Tuesday from the company’s headquarters in Menlo Park, California. He took employee questions about what Facebook knew and when, said the person,... "
841,2018-03-20T19:12:38+00:00,technology, Facebook Nemesis Says ‘I Told You So’ Over Escalating Data Scandal ,https://www.bloomberg.com/news/articles/2018-03-20/facebook-nemesis-says-i-told-you-so-as-data-scandal-escalates," graduate who has taken on Facebook many times and won a landmark European Union court ruling in 2015, said he already sounded the alarm about a “privacy flaw” that exposed Facebook users’ data seven years... "
842,2018-03-09T11:00:12+00:00,technology, South by Southwest Festival Goes From Tech Back-Slapping to Brooding Introspection ,https://www.bloomberg.com/news/articles/2018-03-09/south-by-southwest-festival-goes-from-tech-back-slapping-to-brooding-introspection," on fresh urgency and is the focus of more than a dozen panels.  Revelations around the use of Facebook Inc., Twitter Inc. and YouTube to spread misinformation, influence the U.S. presidential election... "
843,2018-03-08T12:00:05+00:00,, Zuckerberg's Money Manager Bets on Bone-Broth Company ,https://www.bloomberg.com/news/articles/2018-03-08/zuckerberg-s-money-manager-iconiq-bets-on-u-s-nutrition-firm," from investors including Silicon Valley venture firm Iconiq Capital, which invests on behalf of Facebook Inc. founder Mark Zuckerberg and other tech billionaires.VMG Partners led the investment with... "
844,2018-03-08T16:40:46+00:00,politics, Austria and Hungary Move to Resolve Dispute Over Migrant Video ,https://www.bloomberg.com/politics/articles/2018-03-08/austria-hungary-move-to-resolve-dispute-over-migrant-video," the relations with Austria, just to point to the dangers of migration. His video, posted on Facebook this week, had upset some Austrian politicians who otherwise share a lot of the Hungarian government’s... "
845,2018-03-08T00:46:23+00:00,, Sri Lanka Has Blocked Multiple Social Media Networks ,https://www.bloomberg.com/news/videos/2018-03-08/sri-lanka-has-blocked-multiple-social-media-networks-video,                                                                       Sri Lanka has blocked Facebook and other social media networks in an attempt to stop a wave of religious violence #tictocnews... 
846,2018-03-07T07:30:12+00:00,, Brexit Bulletin: Bidding for the Bankers ,https://www.bloomberg.com/news/articles/2018-03-07/brexit-bulletin-bidding-for-the-bankers," com/PaulbernalUK/status/971041391894827008        For more on Brexit follow Bloomberg on Twitter, Facebook and Instagram... "
847,2018-03-06T16:00:01+00:00,technology, How China Protectionism Creates Tech Billionaires Who Protect Xi ,https://www.bloomberg.com/news/articles/2018-03-06/how-china-protectionism-creates-tech-billionaires-who-protect-xi," delivery. In China, it’s Facebook, Twitter, Square, GrubHub rolled into one.Tencent, with a billion users in China, has found little luck in the rest of the world, where Facebook and WhatsApp dominate... "
848,2018-05-12T14:36:43+00:00,view," Ritholtz’s Reads: Crashing Bonds, Van Dyck and the Iceman ",https://www.bloomberg.com/view/articles/2018-05-12/ritholtz-s-reads-crashing-bonds-van-dyck-and-the-iceman," with famed short seller Jim Chanos, president and founder of Kynikos Associates.Google’s and Facebook’s Ad DominationSource: Recode Want to receive our daily reads in your inbox? Sign up here!... "
849,2018-05-10T22:06:24+00:00,technology, Amazon Stops Buying Prized Shopping Ads on Google ,https://www.bloomberg.com/news/articles/2018-05-10/amazon-is-said-to-halt-google-shopping-ads-as-rivalry-heats-up," shareholders. The company has the potential to challenge the digital marketing duopoly of Google and Facebook Inc., although it has expanded slowly so far.Right now, Amazon offers similar sponsored product... "
850,2018-07-25T04:06:36+00:00,markets," Bond Shock May Trigger Stocks Slump, Australia's Magellan Warns ",https://www.bloomberg.com/news/articles/2018-07-25/bond-shock-may-trigger-stocks-slump-australia-s-magellan-warns," said. Cash now makes up 18 percent of the Magellan Global Fund, which counts Alphabet Inc., Facebook Inc. and Kraft Heinz Co. among its top holdings.Asset prices are at or near record highs, and... "
851,2018-07-26T22:54:50+00:00,, Bloomberg Baystate Business: Tech Earnings and News ,https://www.bloomberg.com/news/audio/2018-07-26/bloomberg-baystate-business-tech-earnings-and-news," Spalding.  David Smith, Chief Investment Officer at Rockland Trust, talked about market reaction to Facebook, Amazon and trade worries.  Will Reepmeyer from PwC told us about their 2nd Quarter M&A report... "
852,2018-07-26T20:41:14+00:00,, Bloomberg Markets: Investors Unfriend Facebook ,https://www.bloomberg.com/news/audio/2018-07-26/bloomberg-markets-investors-unfriend-facebook, Carol Massar and Jason Kelly. GUESTS: Sarah Frier Technology Reporter Bloomberg News Discussing Facebook’s historic plunge with Paul Sweeney Bloomberg Intelligence U.S. Director of Research and Senior... 
853,2018-07-26T21:09:23+00:00,technology, Zuckerberg Walloped With $15.9 Billion Loss on Facebook Fallout ,https://www.bloomberg.com/news/articles/2018-07-26/zuckerberg-walloped-with-15-9-billion-loss-on-facebook-fallout, companies in the S&P 500 are worth less than the $15.9 billion that vanished from the fortune of the Facebook Inc. co-founder as shares of the social-media giant plunged 19 percent Thursday. Zuckerberg... 
854,2018-07-26T20:55:21+00:00,markets, Here's How ETFs With Biggest Facebook Exposure Traded Today ,https://www.bloomberg.com/news/articles/2018-07-26/here-s-how-etfs-with-biggest-facebook-exposure-traded-today," SPDR Fund just had its worst day ever. A rout in Facebook Inc. is to blame for that.The exchange-traded fund that has a 22 percent exposure to Facebook, the most among peers, fell 3.8 percent Thursday... "
855,2018-07-26T15:12:59+00:00,, Founders Hold On Tight Even When Investors Really Want Them Gone ,https://www.bloomberg.com/news/articles/2018-07-26/it-s-incredibly-hard-to-fire-a-founder-even-if-he-deserves-it," It’s a common structure, also embraced by tech companies including Google parent Alphabet Inc., Facebook Inc., and Snap Inc. in order to concentrate decision-making power in the hands of founders and... "
856,2018-07-26T10:54:01+00:00,," Facebook Must Leverage Instagram, WhatsApp, Kanji Says ",https://www.bloomberg.com/news/videos/2018-07-26/facebook-must-leverage-instagram-whatsapp-analyst-says-video,"                                        Hussein Kanji, partner at Hoxton Ventures, says that Facebook Inc. has reached market saturation and that it must focus on its Instagram and WhatsApp properties... "
857,2018-07-26T12:16:03+00:00,technology, Facebook Shares Plunge After Slowing Growth ,https://www.bloomberg.com/news/articles/2018-07-26/-don-t-unfriend-facebook-on-valuable-media-assets-analysts-say," social-media giant. As Morgan Stanley noted,“Facebook has shown an ability to innovate and execute through previous challenges.”Read more: How Facebook’s $151 Billion Rout Could Rewrite the History... "
858,2018-07-26T01:55:03+00:00,, Ali and Hadi Partovi on 'Bloomberg Studio 1.0' ,https://www.bloomberg.com/news/videos/2018-07-26/ali-and-hadi-partovi-on-bloomberg-studio-1-0-video," Code.org co-founders Ali and Hadi Partovi speak to Bloomberg's Emily Chang about investing in Facebook, Uber and Dropbox, growing up in Iran, learning how to code, and their success as angel investors... "
859,2018-07-26T02:14:23+00:00,technology," IDC's Del Prete Says Facebook Is Entering a New, Lower-Growth Chapter ",https://www.bloomberg.com/news/videos/2018-07-26/idc-s-del-prete-says-facebook-is-entering-a-new-lower-growth-chapter-video,"                                Crawford Del Prete, IDC's chief operating officer, discusses Facebook Inc.'s second-quarter earnings with Bloomberg's Ramy Inocencio and Yvonne Man on ""Bloomberg... "
860,2018-04-26T09:00:12+00:00,businessweek, New Breed of Shoppers Races to Instagram to Buy Vintage Clothes ,https://www.bloomberg.com/news/articles/2018-04-26/new-breed-of-shoppers-races-to-instagram-to-buy-vintage-clothes," businesses by others—represent a burgeoning corner of social commerce. Though networks such as Facebook, Twitter, Pinterest, and Instagram can heavily influence purchases, transactions happen mostly... "
861,2018-04-26T00:05:28+00:00,, Today's Top Tech Headlines ,https://www.bloomberg.com/news/videos/2018-04-26/today-s-top-tech-headlines-video,               WATCH: @emilychangtv breaks down today's hottest tech headlines #tictocnews - Facebook posts quarterly earnings - Comcast makes $30B cash offer to Sky - Tim Cook meets with President... 
862,2018-04-26T01:13:33+00:00,technology, Facebook Sends Upbeat Growth Message to Wall Street; Shares Jump ,https://www.bloomberg.com/news/articles/2018-04-26/facebook-sends-upbeat-growth-message-to-wall-street-shares-jump," business can serve up relevant promotions and make sure Facebook remains free for its users. And there are plenty more ways for Facebook’s advertising business to expand further, such as through... "
863,2018-04-25T20:44:39+00:00,technology," Facebook Sales Top Estimates, Fueled by Ads; Shares Jump ",https://www.bloomberg.com/news/articles/2018-04-25/facebook-sales-top-estimates-on-advertising-gains-shares-surge," California-based Facebook increases its spending on security, video content and new technologies. The company also said it boosted its stock-buyback program by $9 billion.Facebook still holds a dominant... "
864,2018-04-25T19:30:00+00:00,, Everything You Need to Know This Morning From Daybreak (Podcast) ,https://www.bloomberg.com/news/audio/2018-04-25/everything-you-need-to-know-this-morning-from-daybreak-podcast-jgfhufcw," picked up steam with Twitter smashing estimates, but disappointing with its growth outlook. Facebook’s user numbers and time spent on the site will be in the spotlight when the company reports this... "
865,2018-04-25T12:51:27+00:00,markets," As Most Crowded Trades Turn Sour, Fund Managers Brace for Pain ",https://www.bloomberg.com/news/articles/2018-04-25/as-most-crowded-trades-turn-sour-fund-managers-brace-for-pain," for global fund managers.Shares of the FAANG-BAT complex -- which includes U.S. tech giants Facebook, Amazon, Apple, Netflix, and Google parent Alphabet, as well as China’s Baidu, Alibaba and Tencent... "
866,2018-04-25T11:07:39+00:00,markets, ‘High Water Mark’ Confusion Grabs Hold of Markets: Taking Stock ,https://www.bloomberg.com/news/articles/2018-04-25/-high-water-mark-confusion-grabs-hold-of-markets-taking-stock," release at 7:30am, while the gigantic volume of tonight’s reports stretches throughout tech (Facebook, AMD, Qualcomm, eBay, ServiceNow, F5 Networks, Samsung) in addition to big names like PayPal... "
867,2018-04-25T10:00:16+00:00,view, Tech Companies Should Regulate Themselves ,https://www.bloomberg.com/view/articles/2018-04-25/tech-companies-should-regulate-themselves," this month, Mark Zuckerberg faced intense scrutiny before Congress over the manipulation of Facebook Inc.’s user data by malicious third parties. Zuckerberg issued a broad mea culpa and promised... "
868,2018-04-25T11:17:27+00:00,technology, Charles Schwab CEO Says Using Data Can Better Serve Investors ,https://www.bloomberg.com/news/videos/2018-04-25/charles-schwab-ceo-says-using-data-can-better-serve-investors-video," Erik Schatzker in San Francisco, CA. Bettinger commented on the use of big data and avoiding Facebook-like pitfalls. ... "
869,2018-04-25T09:00:17+00:00,businessweek, Billionaire Tom Steyer’s Quest to Impeach Trump ,https://www.bloomberg.com/news/features/2018-04-25/billionaire-tom-steyer-s-quest-to-impeach-trump, Applause broke out. He smiled and locked eyes with people around the room. Fans following the Facebook livestream sent thumbs-ups by the thousands as he and the five speakers set about explaining... 
870,2018-03-12T18:11:15+00:00,businessweek, Music Executives Find a Facebook Friend to Fight YouTube ,https://www.bloomberg.com/news/articles/2018-03-12/music-executives-find-a-facebook-friend-to-fight-youtube, or bombard Facebook with requests to strip the videos off the internet. The proxy war behind these Facebook music negotiations is where the record labels' savvy is showing. The Facebook deal negotiations... 
871,2018-03-09T12:30:15+00:00,gadfly, Vanguard Crushed Active Investing. Now It Could Save It. ,https://www.bloomberg.com/gadfly/articles/2018-03-09/vanguard-crushed-active-investing-now-it-could-save-it," percentage points over the last five years, so it’s likely to rank low for growth. By contrast, Facebook Inc.’s rankings on value and growth are likely to be just the opposite.   With those factor... "
872,2018-03-09T10:00:12+00:00,businessweek, Bitcoin Is Ridiculous. Blockchain Is Dangerous: Paul Ford ,https://www.bloomberg.com/news/features/2018-03-09/bitcoin-is-ridiculous-blockchain-is-dangerous-paul-ford," products that people use a lot—perhaps a search engine such as Google or a social network like Facebook. You build big transactional web platforms beneath them that provide amazing things, like search... "
873,2018-03-08T16:30:12+00:00,businessweek, Brazil Has a Serious #MeToo Problem ,https://www.bloomberg.com/news/articles/2018-03-08/brazil-has-a-serious-metoo-problem," accusation was a sign the #MeToo movement had made its way to Brazil. In a video Pellegrino posted on Facebook shortly after the incident, she asked, “The actor has done 57 films. Is it possible this was... "
874,2018-03-08T11:00:18+00:00,pursuits, Tommy Hilfger’s Big Bet on Instant Gratification Is Paying Off ,https://www.bloomberg.com/news/articles/2018-03-08/tommy-hilfger-s-big-bet-on-instant-gratification-is-paying-off," TommyNow Snap, an image-recognition app. Elsewhere, artificial-intelligence-powered chatbots used Facebook Messenger to act as virtual stylists for thousands of customers. There was a buzz of interest... "
875,2018-03-07T11:00:00+00:00,technology, BlackBerry's Facebook Suit Is Latest Salvo in Patent Battle ,https://www.bloomberg.com/news/articles/2018-03-07/blackberry-s-facebook-suit-is-latest-salvo-in-patent-battle, bullish sign.”And Facebook is a formidable opponent.“Facebook certainly can afford to fight this and fight it vigorously and there will be other companies looking to Facebook to see how they react... 
876,2018-03-06T07:30:25+00:00,, Brexit Bulletin: The Fudge Continues ,https://www.bloomberg.com/news/articles/2018-03-06/brexit-bulletin-the-fudge-continues," Has it surprised us? No, but it is surprising.”For more on Brexit follow Bloomberg on Twitter, Facebook and Instagram... "
877,2018-03-02T12:53:14+00:00,view, Twitter's Attempt at Self-Regulation Won't Work ,https://www.bloomberg.com/view/articles/2018-03-02/twitter-s-attempt-at-self-regulation-won-t-work," Facebook's self-regulatory contortions in the wake of fake news and trolling scandals have gone on, with little visible effect, for months. Now Twitter founder and Chief Executive Officer Jack... "
878,2018-05-21T10:02:36+00:00,politics, A Turning Point in Trump’s Mueller Stance ,https://www.bloomberg.com/politics/articles/2018-05-21/a-turning-point-in-trump-s-mueller-stance," morning? Sign up for the Balance of Power newsletter, and follow Bloomberg Politics on Twitter and Facebook for more.Donald Trump has long painted Special Counsel Robert Mueller’s investigation as a “witch... "
879,2018-05-20T04:00:07+00:00,, Iconiq Fires Manager Over Old Sex Charge ,https://www.bloomberg.com/news/articles/2018-05-20/iconiq-said-to-fire-manager-over-old-sex-charge-as-metoo-rages," Makan, Chad Boeding, Michael Anders and Will Griffith, is best known for managing the money of Facebook Inc. co-founder Zuckerberg, an early and longtime client. It’s also counted Sandberg, the social... "
880,2018-08-06T20:47:21+00:00,view, Value Stock Breakout Isn't Something to Cheer ,https://www.bloomberg.com/view/articles/2018-08-06/value-stock-breakout-isn-t-something-to-cheer," Index, whose smaller advance reflects some high-profile earnings setbacks at companies including Facebook Inc. and Netflix Inc. Of course, it will take a lot more than a couple of weeks of outperformance... "
881,2018-08-06T15:04:27+00:00,markets, Value Stocks Come Roaring Back From the Dead ,https://www.bloomberg.com/news/articles/2018-08-06/bull-cycle-shift-value-stocks-come-roaring-back-from-the-dead," cracks emerge in momentum equities thanks to earnings disappointments from companies such as Facebook Inc. and Netflix Inc.“Despite ebbing trade tensions, the economic backdrop remained positive... "
882,2018-06-30T12:00:11+00:00,politics," A Retirement, a Failed Coup and a Taboo: Weekend Reads ",https://www.bloomberg.com/politics/articles/2018-06-30/a-retirement-a-failed-coup-and-a-taboo-weekend-reads,"  Sign up for the  Balance of Power newsletter, and follow Bloomberg Politics on Twitter and Facebook for more.Justice Anthony Kennedy’s retirement from the U.S. Supreme Court; a failed plot to... "
883,2018-06-29T04:33:34+00:00,, Professionalism of Slain Newspaper Employees Recalled ,https://www.bloomberg.com/news/articles/2018-06-29/professionalism-of-slain-newspaper-employees-recalled," grief to speak further, Hiaasen referred an AP reporter to something he had just posted to his Facebook page, describing Rob as one of the most ""gentle and funny people I've ever known."" Gunn, the... "
884,2018-06-29T04:29:26+00:00,politics, Shooting Suspect Had Bitter History With Maryland Newspaper ,https://www.bloomberg.com/politics/articles/2018-06-29/shooting-suspect-had-bitter-history-with-maryland-newspaper," claimed Ramos harassed her online for months. The article said Ramos had contacted the woman on Facebook and thanked her ""for being the only person ever to say, 'Hello,' or be nice to him in school... "
885,2018-06-28T01:15:19+00:00,technology, Facebook Payout in Oculus Copyright Spat Cut to $250 Million ,https://www.bloomberg.com/news/articles/2018-06-27/facebook-oculus-virtual-reality-stolen-tech-damages-are-halved, Facebook Inc. won a ruling that halved a jury’s $500 million verdict against its Oculus unit for using computer code in its virtual reality headset that was taken from another company.U.S. District... 
886,2018-06-27T18:16:19+00:00,politics, FEC Considers New Rules for Online Ads ,https://www.bloomberg.com/politics/articles/2018-06-27/federal-election-commission-weighing-new-rules-for-online-ads," deadlocked on granting Facebook the same kind of exemption, in part because the online ads it was selling didn’t always link back to the website of sponsor.Facebook ArchiveFacebook now features a political... "
887,2018-06-27T01:49:48+00:00,technology, GGV Capital's Jenny Lee Sees 'New Facebook Every 3-4 Years in China' ,https://www.bloomberg.com/news/videos/2018-06-27/ggv-capital-s-jenny-lee-sees-new-facebook-every-3-4-years-in-china-video," Source: Bloomberg, 03:54                                                                                                                        GGV Capital Managing Partner Jenny Lee discusses... "
888,2018-05-21T03:00:00+00:00,markets, Spanish Left-Winger Branded Hypocrite Over House Purchase ,https://www.bloomberg.com/news/articles/2018-05-21/spanish-firebrand-s-new-house-highlights-risks-beyond-politics," like this,” Iglesias, the leader of the anti-austerity Podemos party, said in a statement on Facebook with his partner Irene Montero. “And that’s why we think it’s so important to defend dignified... "
