,Timestamp,Metadata,Headline,URL,ShortDesc
508,2018-10-24T09:00:12+00:00,, Alibaba Used Shoppers' Data to Invent a Spicy Snickers Bar ,https://www.bloomberg.com/news/articles/2018-10-24/alibaba-used-shoppers-data-to-invent-a-spicy-snickers-bar," to use the company’s platforms and agree to terms and conditions, much  the way people using Facebook or Amazon do. Still, Chinese consumers are starting to wake up to—and even resent—Alibaba’s... "
509,2018-10-24T06:30:27+00:00,, Brexit Bulletin: Open Conflict ,https://www.bloomberg.com/news/articles/2018-10-24/brexit-bulletin-open-conflict," Brexit negotiations.Want to keep up with Brexit?You can follow us @Brexit on Twitter and join our Facebook group, Brexit Decoded. For all the latest news, visit bloomberg.com/brexit. Got feedback? Send... "
510,2018-07-22T21:00:11+00:00,view, World's Most Powerful App Is Squandering Its Lead ,https://www.bloomberg.com/view/articles/2018-07-22/world-s-most-powerful-app-is-squandering-its-lead, 128 countries while Facebook Messenger reigns in 72. Even Viber is more widespread.But those apps don’t offer payments in all those countries. Although WhatsApp and Facebook Messenger have more... 
511,2018-07-20T00:05:17+00:00,technology, Facebook's Zuckerberg Clarifies Defense of Holocaust Deniers ,https://www.bloomberg.com/news/videos/2018-07-20/facebook-s-zuckerberg-clarifies-defense-of-holocaust-deniers-video, Facebook Inc. Chief Executive Officer Mark Zuckerberg walked back comments that appeared to defend Holocaust... 
512,2018-07-19T21:00:00+00:00,politics, Vietnam to Deport American After Public Disorder Conviction ,https://www.bloomberg.com/politics/articles/2018-07-19/american-arrested-in-vietnam-protests-faces-seven-years-in-jail, concerns over the new cybersecurity law that requires companies such as Alphabet Inc.’s Google and Facebook Inc. to store data of local users in the country.The trial comes after Pompeo raised the issue... 
513,2018-12-12T02:58:33+00:00,technology, Facebook Buildings Evacuated After Bomb Threat; All Staff Safe ,https://www.bloomberg.com/news/articles/2018-12-12/facebook-building-evacuated-after-bomb-threat-police-say," Menlo Park Police Department said in a statement. The headquarters of Facebook-owned Instagram is on that block.A Facebook spokesman said a few buildings were evacuated, but all employees are safe... "
514,2018-12-11T21:03:19+00:00,markets, FAANG Glory Days May Be Over as Headwinds Persist Into Next Year ,https://www.bloomberg.com/news/articles/2018-12-11/faang-glory-days-may-be-over-as-headwinds-persist-into-next-year," signs of cracking in 2018. In 2019, it could collapse.The FAANGs -- an acronym that refers to Facebook, Apple, Amazon, Netflix, and Google-parent Alphabet -- were volatile throughout 2018, with pronounced... "
515,2018-12-14T14:00:55+00:00,view, Proxy Wars and the Struggle for the Soul of Capitalism ,https://www.bloomberg.com/view/articles/2018-12-13/proxy-wars-and-the-struggle-for-the-soul-of-capitalism," appears to be sliding into a fresh bear market, dropping more than 20 per cent. Debt: I enjoyed a Facebook Live session with Bloomberg News’s great Fed-watching correspondent Jeanna Smialek, in which... "
516,2018-12-14T10:42:56+00:00,politics, The Butina 11: Meet the Russians `Handpicked' for Trump Event ,https://www.bloomberg.com/news/articles/2018-12-14/meet-the-russians-picked-for-butina-s-trip-to-trump-breakfast," and so do we.”Andrey Kolyadin, left, and Rex Tillerson at the Prayer Breakfast in 2017.Source: FacebookThough he said he didn’t get a private audience with the new president, he did manage to get... "
517,2018-12-14T07:29:49+00:00,, Brexit Bulletin: Hardball ,https://www.bloomberg.com/news/articles/2018-12-14/brexit-bulletin-hardball," original tweet.Want to keep up with Brexit?You can follow us @Brexit on Twitter and join our Facebook group, Brexit Decoded. For all the latest news, visit bloomberg.com/brexit. Got feedback? Send... "
518,2018-12-14T00:05:26+00:00,technology," Why Facebook, PayPal a 'Match Made in Heaven' ",https://www.bloomberg.com/news/videos/2018-12-14/why-facebook-paypal-a-match-made-in-heaven-video," Bloomberg, 04:22  MoffettNathanson Partner and Senior Equity Analyst Lisa Ellis discusses a possible Facebook Inc. and PayPal Holdings Inc. partnership with Bloomberg's Emily Chang on ""Bloomberg Technology... "
519,2018-12-11T17:57:44+00:00,, Google Faces Similar Issues As Troubled Facebook: Ovide (Radio) ,https://www.bloomberg.com/news/audio/2018-12-11/google-faces-similar-issues-as-troubled-facebook-ovide-radio," Shira Ovide, Bloomberg Opinion technology columnist, on Google CEO Pichai’s testimony before Congress. Hosted by Pimm Foxx and Lisa Ambramowicz. Running time 10:01... "
520,2018-04-10T11:10:51+00:00,, Zuckerberg Says Facebook's Problems Are His Mistake ,https://www.bloomberg.com/news/videos/2018-04-10/zuckerberg-says-facebook-s-problems-are-his-mistake-video,"                               Mark Zuckerberg is set to tell the Senate panels that all of Facebook's problems are his mistake, according to a prepared testimony #tictocnews https://bloom.bg/2GKOAhH... "
521,2018-04-10T11:30:15+00:00,gadfly, Zuckerberg Needs to Emulate Dimon at Congressional Hearings ,https://www.bloomberg.com/gadfly/articles/2018-04-10/zuckerberg-needs-to-emulate-dimon-at-congressional-hearings," shorthand -- a wrong shorthand, to be clear -- that Facebook sells user account information to advertisers.That's not how Facebook works. Facebook builds dossiers on nearly everyone online and gives... "
522,2018-04-10T11:07:47+00:00,markets, FAANGs Can Weather Storm With Confident Zuckerberg: Taking Stock ,https://www.bloomberg.com/news/articles/2018-04-10/faangs-can-weather-storm-with-confident-zuckerberg-taking-stock," hearings over the next two days. How he handles the grilling should dictate the direction of Facebook’s stock (up 0.8% pre-market) and possibly the entire tech tape, given how the Cambridge Analytica... "
523,2018-04-10T08:00:00+00:00,technology, Zuckerberg’s Go-To Strategy Faces Scrutiny in Congress ,https://www.bloomberg.com/news/articles/2018-04-10/zuckerberg-hearings-presage-end-of-move-fast-break-things-era," (Source: Bloomberg)In prepared remarks released Monday, the Facebook chief made clear that business as usual is not an option. Facebook, Zuckerberg said, hasn’t thought about its responsibility to... "
524,2018-04-10T03:26:21+00:00,, Alibaba’s Jack Ma Challenges Mark Zuckerberg to ‘Fix’ Facebook ,https://www.bloomberg.com/news/videos/2018-04-10/alibaba-s-jack-ma-challenges-mark-zuckerberg-to-fix-facebook-video,"                                            Alibaba's Jack Ma urges Mark Zuckerberg to ""fix"" Facebook during #BoaoForum2018 https://bloom.bg/2H6ezQh #tictocnews... "
525,2018-04-09T22:42:47+00:00,technology, Internet Association CEO Says Zuckerberg Has to Regain User Trust ,https://www.bloomberg.com/news/videos/2018-04-09/internet-assoc-ceo-says-zuckerberg-has-to-regain-user-trust-video,                                       Internet Association CEO Michael Beckerman discusses Facebook's reputation following the recent data breach as well as Mark Zuckerberg's upcoming testimony... 
526,2018-04-09T20:04:05+00:00,markets," CalSTRS 'Very Unhappy' With Facebook Governance, CIO Says ",https://www.bloomberg.com/news/videos/2018-04-09/calstrs-very-unhappy-with-facebook-governance-cio-says-video," Retirement System chief investment officer, discusses his decision to deactivate his personal Facebook account and the social-media company's response to its data privacy crisis. He speaks with Bloomberg's... "
527,2018-04-09T19:46:14+00:00,markets," Facebook Crisis Fueled by Zuckerberg’s Star Status, CalSTRS CIO Says ",https://www.bloomberg.com/news/articles/2018-04-09/ailman-says-facebook-crisis-fueled-by-zuckerberg-star-status," Chris Ailman discusses Facebook’s response to its data privacy crisis.(Source: Bloomberg)Ailman, 59, recently captured attention after deactivating his personal Facebook account last week, joining... "
528,2018-04-09T14:43:35+00:00,," Surveillance: China is in a Sweet Spot, Lord Turner Says ",https://www.bloomberg.com/news/audio/2018-04-09/surveillance-china-is-in-a-sweet-spot-lord-turner-says," Bloomberg Intelligence Director of North American Research, says data privacy is not just a Facebook issue, it’s a social media issue. This is a Bloomberg podcast. To download, watch or listen... "
529,2018-04-09T06:30:34+00:00,, Brexit Bulletin: The Road to Another Referendum ,https://www.bloomberg.com/news/articles/2018-04-09/brexit-bulletin-the-road-to-a-second-referendum," Photographer: Matt Cardy/Getty Images EuropeFor more on Brexit follow Bloomberg on Twitter, Facebook and Instagram... "
530,2018-04-09T12:19:10+00:00,technology, Alibaba’s Jack Ma Challenges Mark Zuckerberg to ‘Fix’ Facebook ,https://www.bloomberg.com/news/articles/2018-04-09/alibaba-s-jack-ma-challenges-mark-zuckerberg-to-fix-facebook," about the Facebook furor, the billionaire started dismissing questions but then couldn’t help opining on the crisis facing the U.S. company.Jack MaPhotographer: Qilai Shen/BloombergFacebook’s shares... "
531,2018-04-06T20:31:17+00:00,, Your Evening Briefing ,https://www.bloomberg.com/news/articles/2018-04-06/your-evening-briefing," excessively tight.” Friday’s jobs report showed wages beginning to rise as hiring cooled in March.Facebook will soon let you retract messages, after CEO Mark Zuckerberg was caught using an early version... "
532,2018-04-06T18:39:07+00:00,view, Stingray Devices in Washington Aren't Alone in Spying on Phones ,https://www.bloomberg.com/view/articles/2018-04-06/stingray-devices-in-washington-aren-t-alone-in-spying-on-phones," may not have spent much time perusing Facebook’s terms of service. The challenge for the privacy-conscious user isn’t third parties; the challenge is Facebook itself, which exists not to connect... "
533,2018-04-06T18:00:13+00:00,technology, Facebook Rolls Out Plan to Battle Fake Ads With More Disclosure ,https://www.bloomberg.com/news/articles/2018-04-06/facebook-rolls-out-plan-to-battle-fake-ads-with-more-disclosure," through those steps won’t be able to run either type, Zuckerberg said in a Facebook post.New political adsSource: FacebookFacebook will hire more people to make the change before the 2018 midterm elections... "
534,2018-04-06T17:56:06+00:00,markets, A $1.4 Billion Hedge Fund Is Looking Past Facebook’s Data Troubles ,https://www.bloomberg.com/news/articles/2018-04-06/bannasch-s-1-4-billion-hedge-fund-looks-past-media-facebook-hit," Facebook Inc. may be under global scrutiny amid a data breach scandal, but its fundamentals remain intact.Such is the thinking of Eric Bannasch, the founder of the $1.4 billion hedge fund Cadian... "
535,2018-04-06T09:04:50+00:00,," Sandberg on Trump Election, Leadership ",https://www.bloomberg.com/news/videos/2018-04-06/sandberg-on-trump-election-leadership-video,"                                                                            Sheryl Sandberg, Facebook Inc. chief operating officer, discusses Mark Zuckerberg's leadership as well as the company's... "
536,2018-04-06T09:00:12+00:00,technology, Facebook’s Data Crackdown Has Two Winners: Facebook and Google ,https://www.bloomberg.com/news/articles/2018-04-06/facebook-s-data-crackdown-has-two-winners-facebook-and-google," partnerships, which tap outside data to reach Facebook users, are different than the Cambridge Analytica episode, where internal Facebook data leaked out.Facebook had another program that let advertisers... "
537,2018-04-06T05:00:00+00:00,markets, U.S. Stocks Have Least Power Over Europe Since Financial Crisis ,https://www.bloomberg.com/news/articles/2018-04-06/u-s-stocks-have-least-power-over-europe-since-financial-crisis, between U.S. and European stocks mostly reflects the recent selloff among tech giants such as Facebook Inc. and Amazon.com Inc. Tech accounts for less than 5 percent of the Stoxx 600 compared with... 
538,2018-04-06T02:11:08+00:00,technology, Facebook Faces Indonesian Police Investigation Over Data Breach ,https://www.bloomberg.com/news/articles/2018-04-06/facebook-faces-indonesian-police-investigation-over-data-breach," Tito Karnavian, to investigate the matter after Facebook revealed Thursday that the personal information of more than million Indonesian Facebook users could have been obtained by political consultant... "
539,2018-04-05T17:37:43+00:00,technology, Facebook's Sheryl Sandberg Says Data-Sharing Tool Complied With FTC ,https://www.bloomberg.com/news/articles/2018-04-05/facebook-s-sandberg-says-data-sharing-tool-complied-with-ftc, Trump’s 2016 presidential campaign. The FTC is investigating whether Facebook violated a 2011 decree that requires Facebook to get consent from users before sharing information.“I think we’re very... 
540,2018-04-05T17:18:46+00:00,technology, Here's Why Some Are Saying Facebook's Stock Has Bottomed ,https://www.bloomberg.com/news/articles/2018-04-05/here-s-why-some-are-saying-facebook-s-stock-has-bottomed," Facebook Inc. said it will take years to resolve its security woes. But for investors, recent analyst commentary and market indicators suggest the worst may already be over.Deutsche Bank is “cautiously... "
541,2018-04-05T14:22:53+00:00,view, Spotify's Non-IPO Wasn't Much of an IPO ,https://www.bloomberg.com/view/articles/2018-04-05/spotify-s-non-ipo-wasn-t-much-of-an-ipo, Information. 38 Questions for Mark Zuckerberg. Facebook Says Data on Most of Its 2 Billion Users Is Vulnerable. The Case for a Zuck-Free Facebook. China’s Anbang Insurance Gets $9.7 Billion Capital... 
542,2018-04-04T23:59:00+00:00,, Coming Up On #tictocnews ,https://www.bloomberg.com/news/videos/2018-04-04/coming-up-on-tictocnews-video-jflr7hgo,                                               Here's what's coming up next on #tictocnews - Facebook data of 87 million users compromised - Las Vegas Sands doubles Adelson pay - Tariffs could cost... 
543,2018-04-04T20:16:42+00:00,, Your Evening Briefing ,https://www.bloomberg.com/news/articles/2018-04-04/your-evening-briefing," and Iowa—particularly hard, and make it harder for the GOP to hang onto Congress come November.Facebook said that data on as many as 87 million people may have been improperly shared with research... "
544,2018-04-04T19:24:52+00:00,technology, Facebook Admits Up to 87M People Affected by Cambridge Analytica ,https://www.bloomberg.com/news/videos/2018-04-04/facebook-admits-up-to-87m-people-affected-by-cambridge-analytica-video," Facebook Inc. said that data on as many as 87 million people, most of them in the U.S., may have been... "
545,2018-04-04T19:16:08+00:00,technology, Facebook Says Data on 87 Million People May Have Been Shared ,https://www.bloomberg.com/news/articles/2018-04-04/facebook-says-data-on-87-million-people-may-have-been-shared, in a move that Facebook says was against its rules.Bloomberg’s Emily Chang reports on Facebook’s confirmation of the data shared with Cambridge Analytica.(Source: Bloomberg)Facebook reached the 87... 
546,2018-04-04T16:23:27+00:00,, Mark Zuckerberg To Testify Before House Panel ,https://www.bloomberg.com/news/videos/2018-04-04/mark-zuckerberg-to-testify-before-house-panel-video-jflaxmt6, Facebook's Mark Zuckerberg has agreed to testify before a House panel on April 11 https://bloom.bg/2q6dhKp... 
547,2018-04-04T15:07:25+00:00,technology, Facebook and Twitter Pushed to Do More to Halt Online Opioid Sales ,https://www.bloomberg.com/news/articles/2018-04-04/facebook-twitter-pushed-to-do-more-to-halt-online-opioid-sales, The top U.S. drug regulator wants social-media sites including Facebook Inc. and Twitter Inc. to do more to stop illegal online sales of opioids that are contributing to hundreds of thousands of... 
548,2018-04-04T08:39:59+00:00,markets, China’s Tit-for-Tat Tariffs Send U.S. Index Futures Tumbling ,https://www.bloomberg.com/news/articles/2018-04-04/china-s-tit-for-tat-tariffs-send-u-s-index-futures-tumbling," stocks, as President Donald Trump has criticized Amazon.com Inc. in a series of tweets and as Facebook Inc.’s user-data crisis continues. The S&P 500 had finished back above its 200-day moving average... "
549,2018-04-03T11:40:59+00:00,technology," Bad Year for the FAANGs? In Asia Tech, It's Just A Little Worse ",https://www.bloomberg.com/news/articles/2018-04-03/bad-year-for-the-faangs-in-asia-tech-it-s-just-a-little-worse," funk, try looking at their Asian rivals.For all the recent hand-wringing over the future of Facebook Inc., Apple Inc., Amazon.com Inc., Netflix Inc. and Google parent Alphabet Inc., the U.S. bloc... "
550,2018-09-17T10:00:57+00:00,politics, Brett Kavanaugh Faces Christine Blasey Ford Accusations ,https://www.bloomberg.com/politics/articles/2018-09-17/kavanaugh-s-metoo-moment-imperils-republicans," day? Sign up for the Balance of Power newsletter, and follow Bloomberg Politics on Twitter and Facebook for more.An eleventh-hour sexual assault allegation lodged against President Donald Trump’s... "
551,2018-09-16T04:00:00+00:00,," No Deal, No Problem as Luxembourg Welcomes Brexit Bankers' Kids ",https://www.bloomberg.com/news/articles/2018-09-16/no-deal-no-problem-as-luxembourg-welcomes-brexit-bankers-kids," by the European Schools set up in countries with EU institutions.Expat and parent groups on Facebook Inc.’s social media pages are bursting with questions about schools in the country, with parents... "
552,2018-09-15T02:45:40+00:00,technology, Cathay Pacific to Scrap Hong Kong Flights for Day Amid Typhoon ,https://www.bloomberg.com/news/articles/2018-09-15/airlines-brace-for-worst-as-super-typhoon-heads-for-hong-kong," Shenzhen and Macau, according to a Facebook post. Philippines Airlines Inc. scrapped 41 Saturday flights, including those to Hangzhou and Tokyo, it said on Facebook.It’ll almost certainly get worse... "
553,2018-09-14T19:44:58+00:00,politics, 2018 Governor Election Forecasts ,https://www.bloomberg.com/politics/articles/2018-09-14/2018-governor-election-forecasts, up for our daily newsletter on global politics and follow Bloomberg Politics on Twitter and Facebook.Balance of PowerWatch to see how Friday morning’s three bombshell reports reverberate across... 
554,2018-09-14T17:24:51+00:00,technology, Facebook’s Zuckerberg to Testify in November in Investor Suit ,https://www.bloomberg.com/news/articles/2018-09-14/facebook-s-zuckerberg-to-testify-in-november-in-investor-suit," Facebook Inc. co-founder Mark Zuckerberg is slated to appear before a judge Nov. 19 to explain why he dropped a plan to create non-voting shares, which would’ve allowed him to retain control of... "
555,2018-09-21T15:41:50+00:00,view, Oil Prices Get More Love Than E&P Companies ,https://www.bloomberg.com/view/articles/2018-09-21/oil-prices-get-more-love-than-e-p-companies," crashed in late 2008 — along with everything else — the first iPhone was barely a year old and Facebook Inc. was still years away from its IPO. “Peak oil,” meanwhile, meant running out of barrels;... "
556,2018-09-21T04:00:00+00:00,politics," Hacks, Phishing and Fake News: Russia-Proofing a Baltic Election ",https://www.bloomberg.com/news/articles/2018-09-21/hacks-phishing-and-fake-news-russia-proofing-a-baltic-election," receiving “threat feeds” from NATO and allied countries.Elsewhere, the government is working with Facebook Inc. and Twitter Inc. to stem the spread of fake news. Ballots at the Oct. 6 vote will be scanned... "
557,2018-09-20T18:32:55+00:00,view, Marijuana Stock Tilray's (TLRY) Buzz Isn't Sign of Market Bubble ,https://www.bloomberg.com/view/articles/2018-09-20/marijuana-stock-tilray-s-tlry-buzz-isn-t-sign-of-market-bubble," valued FANGs of the technology industry. Netflix Inc.’s price-earnings ratio is a gargantuan 136. Facebook Inc., Amazon.com Inc., Apple Inc., Netflix and Google-parent Alphabet Inc. have a combined market... "
558,2018-09-20T01:00:53+00:00,technology," Quartz's New Owner Ready to Fight Facebook, Twitter on Home Turf ",https://www.bloomberg.com/news/articles/2018-09-20/quartz-s-new-owner-ready-to-fight-facebook-twitter-on-home-turf," Umeda saw similar editorial values at Quartz and an opportunity to expand internationally. With Facebook Inc., Twitter Inc., and Google-parent Alphabet Inc. coming under fire for corrupting political... "
559,2018-09-19T06:30:22+00:00,, Brexit Bulletin: ‘The Moment of Truth’ ,https://www.bloomberg.com/news/articles/2018-09-19/brexit-bulletin-the-moment-of-truth," data for August. Want to keep up with Brexit?You can follow us @Brexit on Twitter and join our Facebook group, Brexit Decoded. For all the latest news, visit bloomberg.com/brexitKnow someone who’d... "
560,2018-08-24T00:12:06+00:00,markets," U.S.-China Fail, Aussie PM Crisis, Powell Revisits '98: Eco Day ",https://www.bloomberg.com/news/articles/2018-08-24/u-s-china-fail-aussie-pm-crisis-powell-revisits-98-eco-day," policyAs the economic landscape gets more rocky, Southeast Asia’s central bankers are turning to Facebook and YouTube for help in getting their messages across In New Zealand, the central bank chief... "
561,2018-08-23T18:53:49+00:00,technology, Google Removes YouTube Channels and Web Accounts Tied to Iran ,https://www.bloomberg.com/news/articles/2018-08-23/google-removes-youtube-channels-and-web-accounts-tied-to-iran," outlet, citing ""attempted state-sponsored hacking and influence campaigns."" The move comes after Facebook Inc. and Twitter Inc. pulled hundreds of social accounts tied to Iran for similar reasons.Alphabet... "
562,2018-08-23T19:07:33+00:00,technology, Space Investors Urged to Get Their Heads in the Clouds ,https://www.bloomberg.com/news/articles/2018-08-23/space-investors-urged-to-get-their-heads-in-the-clouds," global space sector: Adobe, Alphabet Inc., Analog Devices, Amazon.com Inc., Apple Inc., Boeing, Facebook Inc., GoDaddy Inc., Honeywell, Inmarsat, Intuit, Lockheed Martin, Microsoft Corp. Northrop Grumman... "
563,2018-08-23T14:58:53+00:00,technology," Google, Apple Face Growing Backlash Over App Store Tax ",https://www.bloomberg.com/news/articles/2018-08-23/apple-and-google-face-growing-revolt-over-app-store-tax," misses out on at least $50 million. A Google spokeswoman declined to comment.Earlier this week, Facebook Inc. scrapped a 30 percent cut it took from in-app purchases made on some games played through... "
564,2018-08-22T14:29:40+00:00,politics," U.S., China Restart Trade Talks as Billions More in Tariffs Loom ",https://www.bloomberg.com/politics/articles/2018-08-22/u-s-china-restart-trade-talks-as-billions-more-in-tariffs-loom," Council, testified Tuesday. The group represents companies including Amazon Inc., Apple Inc. and Facebook Inc. ... "
565,2018-08-22T09:00:17+00:00,businessweek, Nobody Trusts Facebook. Twitter Is a Hot Mess. What Is Snap's Evan Spiegel Doing? ,https://www.bloomberg.com/news/features/2018-08-22/nobody-trusts-facebook-twitter-is-a-hot-mess-what-is-snap-s-evan-spiegel-doing," the word “Facebook,” but the reference was obvious. Snap employees see Mark Zuckerberg’s social network as the villain in their virtuous fight against vanity and virality. Unlike Facebook, nothing... "
566,2018-08-22T05:53:25+00:00,technology, LinkedIn To Allow Academic Researchers to Mine User Data ,https://www.bloomberg.com/news/articles/2018-08-20/linkedin-will-allow-economics-researchers-to-mine-its-data," Once upon a time, Facebook Inc. allowed academic researchers access to its data. We know how that story ends: with the Cambridge Analytica scandal.Now LinkedIn Corp., the professional social networking... "
567,2018-08-22T04:29:10+00:00,pursuits, How Huda Kattan Built a $1 Billion Beauty Business on Instagram ,https://www.bloomberg.com/news/articles/2018-08-22/how-huda-kattan-built-a-1-billion-beauty-business-on-instagram," over the phone. “I look like an Oompa Loompa!”The hit show attracts up to 9 million viewers on Facebook Watch, but it’s just one of many milestones for the 34-year-old since she introduced her first... "
568,2018-08-29T08:00:00+00:00,politics, Trump Takes Battle Over Media Coverage to `Rigged' News Feeds ,https://www.bloomberg.com/politics/articles/2018-08-29/trump-takes-battle-over-media-coverage-to-rigged-news-feeds," public.In a series of tweets and public comments Tuesday, Trump warned Alphabet Inc.’s Google, Facebook Inc. and Twitter Inc. that they “better be careful” though he didn’t specify what actions he... "
569,2018-08-29T09:00:01+00:00,," For Goldman, a New Tax Break Makes Helping Poor More Lucrative ",https://www.bloomberg.com/news/articles/2018-08-29/goldman-sachs-leads-race-for-tax-break-helping-poor-communities," Innovation Group, a non-profit founded by Sean Parker, the Napster creator and first president of Facebook Inc. The think tank proposed opportunity zones three years ago in a white paper written by Jared... "
570,2018-07-11T12:28:59+00:00,, Facebook Faces U.K. Fine Over Cambridge Analytica ,https://www.bloomberg.com/news/videos/2018-07-11/facebook-faces-u-k-fine-over-cambridge-analytica-video," Facebook could be fined #500,000 ($664,000) over the Cambridge Analytica scandal https://bloom.bg/2KMX0ra... "
571,2018-07-10T22:04:20+00:00,politics, Senate Republicans Question App Developers’ Gmail Access ,https://www.bloomberg.com/politics/articles/2018-07-10/gmail-access-by-app-developers-questioned-by-senate-republicans," of Cambridge Analytica, a political firm that obtained access to the data of up to 87 million Facebook Inc. users without their consent via an outside app developer.The fallout from Cambridge Analytica... "
